id,url,title,park alpha,description,category,relatedRoadEvents,LastIndexedDate,road_closed_flag,Park Name,Type of Unit,State,Reg,Alpha,Unit
9DCFFBFE-8F65-4E8D-B64D-1B7E853C1180,,Trail Work on Maryland Heights--Trail OPEN,HAFE,"Due to trail improvements, use caution when hiking the Maryland Heights Trail. Trail work is expected to be ongoing through June, and will involve dump trucks and a skid steer. The trail will remain OPEN, although it may require short delays to hikers.",Caution,[],2023-05-11 11:04:54.0,0,Harpers Ferry,National Historical Park,WV,NCR,HAFE,1.0
5ECF9D1C-32BD-4F1A-A83E-8323431101ED,https://www.nps.gov/carl/planyourvisit/frontlakedam.htm,Pedestrian Bridge at Front Lake is Closed,CARL,"The pedestrian bridge at the main entrance to the park is closed. During the closure, visitors must walk an additional 0.4 mile around Front Lake, and then 1/3 mile up a hill to the Sandburg Home and farm. For accessibility options, call 828-707-8125.",Caution,[],2023-05-08 13:46:54.0,0,Carl Sandburg Home,National Historic Site,NC,SER,CARL,1.0
EF5F599E-410E-4D46-B869-BBE8F7FF06B1,,Painted Hills- Large RV or Travel Trailer not Recommended Beyond Overlook Trail,JODA,Don’t get your vehicle stuck at the Painted Hills! We want you and your RV or large bus to enjoy your trip. Travel trailers or large buses are not recommended beyond the Overlook Trail at Painted Hills due to limited turning radius.,Caution,[],2023-05-03 18:58:45.0,0,John Day Fossil Beds,National Monument,OR,PWR,JODA,1.0
2C1BA1C6-DEA7-4219-AC32-C7281ADCE8C8,,No Boundary Access to Pocosin Hollow Trail,SHEN,Boundary access to Pocosin Hollow Trail off State Rt. 667 is no longer available.,Information,[],2023-05-03 11:33:50.0,0,Shenandoah,National Park,VA,NER,SHEN,1.0
5A762269-11E7-415F-86B5-322EF0268A1B,,Riprap Boundary Access Closure,SHEN,Public access to the Riprap trail system at the park boundary via Wild Turkey Lane is no longer available due to private landowner concerns. Please use Skyline Drive to access this trail system.,Information,[],2023-05-03 11:30:57.0,0,Shenandoah,National Park,VA,NER,SHEN,1.0
61F3F06C-E629-4EA2-BFC4-AD3B96822529,https://www.nps.gov/grfa/index.htm,Great Falls Visitor Center Closed for Construction,GWMP,"The Visitor Center at Great Falls Park is temporarily closed for construction, but the restrooms remain open 9:30 - 5:30, and overlooks and trails remain open.",Park Closure,[],2023-05-03 09:25:29.0,0,George Washington,Memorial Parkway,DC,NCR,GWMP,1.0
A787CC21-1CBF-4C28-A650-C0AA82DB3271,https://www.nps.gov/apis/planyourvisit/conditions.htm#CP_JUMP_6610817,Ongoing Storm Damage Closures,APIS,Ongoing list of closures related to previous storm damage for public safety: Devils Island Dock & Campsite; West Bay Club on Sand Island.,Park Closure,[],2023-05-02 06:28:20.0,0,Apostle Islands,National Lakeshore,WI,MWR,APIS,1.0
3B92EB38-104F-446B-ADF3-351E7FF37F03,,Sagamore Hill is Cashless,SAHI,Cash payments at Sagamore Hill are no longer accepted as a method of payment for National Parks and Federal Recreational Lands Passes. Credit and Debit Cards are accepted.,Information,[],2023-04-29 09:44:10.0,0,Sagamore Hill,National Historic Site,NY,NER,SAHI,1.0
9B98D05C-0E8A-4B88-B5E0-75C54A063638,,Water Hazards Present,AMIS,"Due to decreasing water levels, underwater hazards are present in the lake. Please be extra vigilant for potential damage to boat or other injury.",Danger,[],2023-04-27 16:52:44.0,0,Amistad,National Recreation Area,TX,IMR,AMIS,1.0
5D458C35-B536-414C-99C5-30580D5EB004,,Most Monument Roads Require Heavy Duty 4WD Vehicle to Travel Safely,CAMO,"Breaking down in the remote monument can be a life-threatening emergency. Most roads require a well-equipped, heavy-duty 4WD vehicle to travel. 2WD high clearance vehicles must use Walking Box Ranch Rd for entry and exit. No Visitor Facilities Available.",Danger,[],2023-04-27 12:00:06.0,1,Castle Mountains National Monument,Castle Mountains National Monument,CA,PW,CAMO,
C1CAE3CD-FB4B-47A6-96E7-86B2D145C47F,https://www.nps.gov/buis/planyourvisit/permits.htm,Anchoring Permit Required for All Vessels,BUIS,"Anchoring is allowed only by permit and only in the designated location on the west side of Buck Island. Permits are free, valid for one year and available at the Danish West India & Guinea Company Building.",Information,[],2023-04-24 11:23:19.0,0,Buck Island Reef,National Monument,VI,SER,BUIS,1.0
3B77268F-05BD-4B25-8631-CC055D7BB2FF,https://www.nps.gov/prwi/learn/news/prince-william-forest-park-to-pilot-cashless-payment-starting-may-1st.htm,Credit/Debit Card only for park entrance fees starting May 1st,PRWI,"Starting May 1, 2023, Prince William Forest Park will enter a trial period of no longer accepting cash for park entrance fees. Entrance fees and passes can be purchased with credit/debit card or online through recreation.gov.",Information,[],2023-04-22 16:57:33.0,0,Prince William Forest,Park,VA,NCR,PRWI,1.0
94AC1172-65A1-43D0-A4CC-483F24221543,,Roadwork may cause delays on US 41/Tamiami Trail,EVER,"Current roadwork is ongoing along the park's northern boundary on US Highway 41/Tamiami Trail to raise the road for Everglades Restoration benefits. Drivers may experience up to 15-minute delays and should watch for personnel, equipment and slow downs.",Caution,[],2023-04-20 18:00:07.0,1,Everglades,National Park,FL,SER,EVER,1.0
CEBA5934-3BA7-49A0-942D-260E8323A54A,https://www.parks.ca.gov/?page_id=471,Mount Tamalpais State Park - Trail Conditions,MUWO,"Many trails in Muir Woods connect to trails in Mount Tamalpais State Park. For up-to-date information about trail conditions within State Park boundaries, check the Mount Tamalpais State Park Info page (click more) and scroll down to Trail Updates.",Information,[],2023-04-20 15:52:27.0,0,Muir Woods,National Monument,CA,PWR,MUWO,1.0
149A41F1-E065-4D13-B196-21994345C69D,https://www.nps.gov/voya/learn/news/voya-closes-cranberry-creek-to-locator-lake-trail-temporarily.htm,Cranberry Creek to Locator Lake Trail is Closed.,VOYA,The Cranberry Creek to Locator Lake trail is closed until further notice due to beaver damming and flooding which is making the trail impassable. Signs are posted at the trail entrance.,Caution,[],2023-04-19 11:26:49.0,0,Voyageurs,National Park,MN,MWR,VOYA,1.0
56428879-D259-494A-94BA-8E2DF282D81A,https://www.nps.gov/voya/learn/news/voyageurs-national-park-temporarily-closes-kab-ash-trail-access-at-salmi-road-entrance.htm,Salmi Road Entrance to the Kab-Ash Trail out of the Kabetogama Community Remains Temporarily Closed.,VOYA,"Salmi Road entrance to the Kab-Ash Trail remains temporarily closed at the trail's western most terminus. Access to the trail remains open at trailheads along Ash River Trail road, Meadwood Road, and the eastern terminus within the community of Ash River.",Park Closure,[],2023-04-19 11:25:14.0,1,Voyageurs,National Park,MN,MWR,VOYA,1.0
9B0FC79E-9BEA-4040-AFBF-D6AE67199D99,,No Hot Showers at Big Spring Campground,OZAR,There are currently NO HOT SHOWERS available at the Big Spring Campground. Cold Showers are available at the group sites. We expect this issue to remain throughout the summer as we await delivery of a new showerhouse expected in the fall.,Information,[],2023-04-18 15:31:51.0,0,Ozark,National Scenic Riverways,MO,MWR,OZAR,1.0
C36AAE9D-DF25-4892-979F-E4A2DBFF698F,,Visitor Center Closed,SARI,The Salt River Bay NHP&EP Visitor Contact station remains closed due to damage caused by Hurricanes Irma/Maria.,Park Closure,[],2023-04-18 14:17:29.0,0,Salt River Bay,National Historic Park and Ecological Preserve,VI,SER,SARI,1.0
FE68E606-986A-484D-A195-832BDA45A6BA,,The Steeple Building Closed,CHRI,The Steeple Building remains closed until further notice.,Information,[],2023-04-18 14:08:34.0,0,Christiansted,National Historic Site,VI,SER,CHRI,1.0
6264FD94-2162-4EA2-A56E-FDAEC91695FF,,Hospital Street Restrooms Closed,CHRI,The public restrooms on Hospital Street are closed. Temporary restrooms have been placed in the parking lot of Fort Christiansvaern.,Information,[],2023-04-18 14:05:05.0,0,Christiansted,National Historic Site,VI,SER,CHRI,1.0
707C395F-4061-4916-B812-D966BD05BC70,,County Line Road Closed Monday To Friday,VAFO,"County Line Road is closed during the week, from Monday through Friday. The closure will apply to all vehicular, pedestrian, and bicycle traffic. Please find an alternate route.",Information,[],2023-04-17 13:51:33.0,0,Valley Forge,National Historical Park,PA,NER,VAFO,1.0
04B46022-545B-48CC-A8C8-5136963DD7A2,https://www.rooseveltcampobello.org/about-visitor-information,Roosevelt Campobello International Park is located in Welshpool.,ROCA,"Campobello Island is located in the province of New Brunswick, Canada. The physical address for the Visitor Centre is: 459 Route 774 Welshpool, New Brunswick, Canada E5E 1A4",Information,[],2023-04-14 12:32:15.0,0,,,,,,
37B52398-D2D7-4AC1-80E7-F36DDB71D3B2,,Passaic River Trail Bridge washed out,MORR,"Tropical Storm Ida washed out the Passaic River bridge on the Patriot's Path Trail south of Tempe Wick Road. This area is a known habitat of the endangered wood turtle, so do not wade, walk, or let your dog run in the river at this location.",Caution,[],2023-04-12 15:15:21.0,0,Morristown,National Historical Park,NJ,NER,MORR,1.0
E3DBE36F-F3A6-4AD6-9498-4F2601DF13AC,,"Volcano Road Closed to RVs and Buses over 26 feet, and to all Trailers.",CAVO,"The Volcano top road is not accessible to RVs, buses, attached trailers, or any other vehicle over 26 feet in length, due to the narrowness and weight limits of Volcano Road. Trailer drop off and RV/bus parking is available at the Visitor Center.",Park Closure,[],2023-04-11 13:13:44.0,1,Capulin Volcano,National Monument,NM,IMR,CAVO,1.0
C645B941-2E9C-49AF-9EB3-3EED7B687AC9,https://www.nps.gov/euon/planyourvisit/permits-and-reservations.htm,No Visitor Vehicle Access to the Park Site,EUON,Eugene O'Neill NHS is only accessible by free park shuttle or by hiking trails through Las Trampas Regional Wilderness. Details under permits and Reservations.,Information,[],2023-04-09 16:40:47.0,0,Eugene O'Neill,National Historic Site,CA,PWR,EUON,1.0
3BC03A1C-742E-4D06-AEAF-3CAD64FB2F14,,"Park Closed on Mondays, Tuesdays, and Wednesdays.",THST,"Thomas Stone National Historic Site is closed on Mondays, Tuesdays, and Wednesdays. The park is open Thursday through Sunday, 10:00 - 4:00 pm.",Information,[],2023-04-07 15:59:12.0,0,Thomas Stone,National Historic Site,MD,NER,THST,1.0
FD95C151-6602-4185-89F1-55999E7EA144,https://www.nps.gov/pohe/getinvolved/partners.htm,Some facilities closed along the Potomac Heritage National Scenic Trail,POHE,"Please see our partner sites to find the most up-to-date information on closures, re-routes, or conditions along the Trail.",Information,[],2023-04-06 10:28:08.0,0,Potomac Heritage,National Scenic Trail,"DC,MD,PA,VA",NCR,POHE,1.0
4F68E6CB-F36B-4B8D-93AC-34F42FDF2C1C,https://www.nps.gov/zion/planyourvisit/flash-flood.htm,Avoid flash floods,ZION,"Flash floods are a sudden increase in the depth and speed of water in rivers, streams, or washes due to rain. Flood waters carry large debris like tree trunks and boulders and can happen at any time in Zion.",Caution,[],2023-03-31 11:48:48.0,0,Zion,National Park,UT,IMR,ZION,1.0
55067698-5F3E-4178-946B-0B8F1B8EF1D0,https://www.nps.gov/noca/planyourvisit/lake-and-river-conditions.htm,Diablo Lake Boat Launch Inaccessible to Powerboats,NOCA,"Due to silt accumulation, the Diablo Lake boat launch at Colonial Creek South Campground is not usable for launching most powerboats. Expect shallow or no water at the launch ramp and the possibility of needing to carry your boat to or from the water.",Caution,[],2023-03-30 18:30:13.0,0,North Cascades,National Park,WA,PWR,NOCA,1.0
C5C57A4D-D545-454B-8E5B-FD0D8233477D,https://www.nps.gov/cuva/learn/news/national-park-service-purchases-198-acres-in-the-heart-of-cuyahoga-valley-national-park-cvnp-from-conservancy.htm,Former Golf Course Property,CUVA,"The former golf course property in Peninsula, including a section of the Valley Trail, is closed during environmental remediation.",Park Closure,[],2023-03-29 16:27:17.0,0,Cuyahoga Valley,National Park,OH,MWR,CUVA,1.0
E9596680-BA9D-4024-AB75-62BAE048CDE7,,Park Closed Tuesdays and Wednesdays,ELMO,"The visitor center and all park trails are closed on Tuesdays and Wednesdays. Open Thursday through Monday, from 9 am - 5 pm. Hiking park trails is not permitted when the park is closed.",Park Closure,[],2023-03-26 14:46:02.0,0,El Morro,National Monument,NM,IMR,ELMO,1.0
2769E44A-3C7E-4703-8702-44862D407814,https://www.nps.gov/liri/planyourvisit/psar.htm,SEASONAL SAFETY MESSAGE,LIRI,"Be careful and safe while out in the canyon! Be cautious of your surroundings, don't cliff jump, don't stray off of the main trails, and don't get too close to Little River Falls or the canyon rim. These activities could result in injury or death.",Danger,[],2023-03-23 14:16:55.0,0,Little River Canyon,National Preserve,AL,SER,LIRI,1.0
A47534F6-D95D-4BFD-8B92-84BA5D7614FC,https://www.nps.gov/articles/unmanned-aircraft-in-the-national-parks.htm,Fort Davis NHS is a NO DRONE Zone!,FODA,The use of drones is prohibited at Fort Davis National Historic Site. Thank you for preserving the cultural landscape.,Information,[],2023-03-23 09:28:51.0,0,Fort Davis,National Historic Site,TX,IMR,FODA,1.0
82B28471-5297-45AB-BFA9-2CE35B9A9806,,Fort Davis NHS is in the Central Time Zone,FODA,Fort Davis National Historic Site is located in the Central Time Zone. The park is open 8:00 am until 5:00 pm (Central Time). The Visitor Center closes at 4:30pm. The Main Gate locks at 5:00pm.,Information,[],2023-03-23 09:28:40.0,0,Fort Davis,National Historic Site,TX,IMR,FODA,1.0
7E9BD493-EB00-44E7-8098-B1B581FD59D7,https://www.nps.gov/zion/planyourvisit/toxic-cyanobacteria-bloom-in-the-virgin-river-and-the-streams-of-zion-national-park.htm,Toxic Cyanobacteria in the Virgin River and the streams of Zion National Park,ZION,Do not submerge your head in or filter drinking water from still or moving water.,Caution,[],2023-03-15 20:31:23.0,0,Zion,National Park,UT,IMR,ZION,1.0
C2ED81E8-F50F-42E2-94FE-83713735767E,https://www.nps.gov/gate/protecting-plovers.htm,Dogs Not allowed on ocean beaches in Jamaica Bay and Sandy Hook March 15- Sept. 15,GATE,"Dogs are not allowed on ocean beaches at Sandy Hook between March 15 through September 15. Dogs are not allowed on the ocean beaches at Jacob Riis Park, Fort Tilden, Breezy Point Tip and at the bayside of Breezy Point between March 15 through September 15",Information,[],2023-03-15 15:55:13.0,0,Gateway,National Recreation Area,"NY,NJ",NER,GATE,1.0
21D2E976-BD10-46C1-A7CB-1CBF7EE7E6C8,https://www.nps.gov/jeff/planyourvisit/old-courthouse-renovation.htm,Old Courthouse Closed for Renovations,JEFF,"The Old Courthouse at Gateway Arch National Park is undergoing renovations as part of the $380-million CityArchRiver project, which is the largest public-private partnership in the history of the National Park Service. It is closed to all visitors.",Park Closure,[],2023-03-14 13:01:16.0,0,Jefferson,National Expansion Memorial,MO,MWR,JEFF,1.0
85411F91-3782-4041-8936-1E9C81C01C32,,Vehicle Break-Ins,SAGU,"Saguaro National Park is an urban park. Vehicle break-ins have occurred at trailheads around the park. Don't make yourself a target. Leave valuables at home, secure your vehicle, and report any suspicious activity.",Caution,[],2023-03-09 13:22:42.0,0,Saguaro,National Park,AZ,IMR,SAGU,1.0
F74FF9D9-C95A-41F5-96E7-8D8B21006B04,,Temporary Blackland Prairie Trail Closure to Equestrians,NATT,"Heavy rain has undermined a culvert making it unsafe for passage. Due to horse trailer parking availability, the entire section is closed to equestrians. Hikers are still able to travel from the railroad tracks to the Parkway Visitor Center.",Park Closure,[],2023-03-08 14:47:37.0,1,,,,,,
7E3D0421-046D-4530-B903-5B38D031D34D,https://www.nps.gov/ovvi/learn/news/southern-campaign-of-the-american-revolution-parks-are-adding-access-for-visitor-services.htm, Phased Reopening and Outdoor Programming,OVVI,"We are increasing access to the parks in phases. Beginning 1/15/2023, visitor centers at Cowpens and Kings Mountain will open 9 – 5 on Wed – Sun. Grounds & restrooms open daily 9 – 5.",Information,[],2023-03-02 15:49:21.0,0,,,,,,
7F2A2867-1EB1-4205-B1CA-CC47E602DF28,,Avoid area around the church & under trees in high wind conditions,SAPA,"In high wind conditions (sustained winds of 25 mph and above) visitors are advised to avoid the area around the church, with the possibility of falling clay tiles from the roof, and the cemetery, possibility of falling tree branches or limbs. Thank you.",Caution,[],2023-03-01 09:06:43.0,0,Saint Paul's Church,National Historic Site,NY,NER,SAPA,1.0
1E61F2B0-1605-4B4D-BB59-E8DA4225A027,,Giftshop closed the last Tuesday of every month,TUAI,The giftshop will be closed the last Tuesday of every month for inventory.,Information,[],2023-02-28 11:08:55.0,0,Tuskegee Airmen,National Historic Site,AL,SER,TUAI,1.0
E1616CE9-9B3E-43E7-BC07-18E2DE4091D0,,Wupatki VC Phone Outages,WUPA,The main phone line for the visitor center experiences occasional outages. Please call 928-856-1705 if you have trouble getting through on the main number.,Information,[],2023-02-25 15:48:38.0,0,Wupatki,National Monument,AZ,IMR,WUPA,1.0
4977821D-AB21-4360-BB10-75D45A339D49,https://www.nps.gov/care/planyourvisit/special-use-permits.htm,Special Use Permits,CARE,"Special Use Permits are typically needed for activities that benefit a specific group. Examples include: Groups of 40 or more, trips organized by scouting groups, churches, or academic institutions, photography, weddings, and first amendment activities",Information,[],2023-02-23 17:40:28.0,0,Capitol Reef,National Park,UT,IMR,CARE,1.0
422046BA-4A53-4771-8241-2DDB465B3ACD,,Weather Advisory and Storm Warnings,CACH,The park may have delayed openings or closures in the event of severe weather. Travel may not be recommended during these times. Please check local weather forecasts. We appreciate your understanding.,Caution,[],2023-02-23 15:02:25.0,0,Canyon De Chelly,National Monument,AZ,IMR,CACH,1.0
5D8D60A9-C098-496F-AE38-8C9EE0B1A8E3,,Weather Advisory and Storm Warnings,NAVA,The park may have delayed openings or closures in the event of severe weather. Travel may not be recommended during these times. Please check local weather forecasts. We appreciate your understanding.,Caution,[],2023-02-23 14:57:36.0,0,Navajo,National Monument,AZ,IMR,NAVA,1.0
6B79B8F1-03AB-433F-AECC-D3A44BE86457,,Weather Advisory and Storm Warnings,HUTR,The park may have delayed openings or closures in the event of severe weather. Travel may not be recommended during these times. Please check local forecasts. We appreciate your understanding.,Caution,[],2023-02-23 14:42:01.0,0,Hubbell Trading Post,National Historic Site,AZ,IMR,HUTR,1.0
2B5F9188-28AA-4FD6-B13C-F172D2C3B145,https://www.nps.gov/zion/planyourvisit/angels-landing-hiking-permits.htm,Angels Landing Pilot Permit Program,ZION,Everyone who hikes Angels Landing needs to have a permit. Learn why you need a permit and how to get one. This requirement does not affect entering the park or riding the park shuttle (when it is running).,Information,[],2023-02-18 12:39:08.0,0,Zion,National Park,UT,IMR,ZION,1.0
E25DDCA1-91BE-422E-83B4-063ADED63F10,https://www.nps.gov/hono/faqs.htm,Park Closed to the Public,HONO,"The park is currently closed to the public. If you would like learn more about Honouliuli when visiting O‘ahu, you can visit our partner at the Japanese Cultural Center of Hawai‘i in Honolulu.",Park Closure,[],2023-02-16 11:01:46.0,0,Honouliuli National Monument,Honouliuli National Monument,HI,PW,HONO,
8B82698E-3A4B-434C-956D-150116E732EF,,Wind Cave moves to cashless fee collection,WICA,"Payments for cave tours, campground fees, as well as Interagency Passes at Wind Cave National Park, will be by credit/ debit cards or digital payments only. Cash and check payments will no longer be accepted.",Information,[],2023-02-10 17:18:28.0,0,Wind Cave,National Park,SD,MWR,WICA,1.0
D9568678-93F1-4536-AB41-40EEA2C555F1,https://www.nps.gov/ever/planyourvisit/fees.htm,"For entrance fees, we accept digital passes and credit/debit cards",EVER,Digital passes or credit/debit cards are the ONLY method of payment at all fee collection areas. Pre-paid digital passes are available online and may be purchased in advance.,Information,[],2023-02-08 11:51:02.0,0,Everglades,National Park,FL,SER,EVER,1.0
011A7F88-A3F6-48D5-B4C4-711CF086ED39,https://www.nps.gov/coro/planyourvisit/safety.htm,Be Aware of Illegal Traffic,CORO,Smuggling and/or illegal entry is common in this area due to the proximity of the international border. Please be aware of your surroundings at all times and do not travel alone in remote areas.,Caution,[],2023-02-08 11:01:39.0,0,Coronado,National Memorial,AZ,IMR,CORO,1.0
6E13AD2C-7682-4D47-B576-CAA6A5C2E22A,,Delassus-Kern House and Property Closed,STGE,"Due to hazardous conditions, the Delassus-Kern House and surrounding property are closed indefinitely.",Park Closure,[],2023-02-03 10:51:10.0,0,,,,,,
AF760212-5E11-413F-A4FC-9BF9E1AA5AE6,https://www.nps.gov/drto/learn/ianclosure.htm,Closures on parts of Garden Key and Loggerhead Key,DRTO,"Until further notice, all finger piers and slips, and the dinghy beach between the finger piers and the South Coaling Dock are closed on Garden Key. On Loggerhead Key, the Historic Preservation/Adaptive Use zone around the lighthouse is closed.",Park Closure,[],2023-02-02 12:54:45.0,0,Dry Tortugas,National Park,FL,SER,DRTO,1.0
01E8D872-D1CA-4976-8ADD-2F3256E18900,,Building Closures - Historic Preservation,HOFU,"There are a few projects underway. From time to time this may require that we close certain areas or structures for the protection of our staff, visitors, and park resources. We appreciate your understanding while we perform this critical work.",Information,[],2023-01-20 12:32:00.0,0,Hopewell Furnace,National Historic Site,PA,NER,HOFU,1.0
EB51BF6C-B885-4976-8E3A-88851A094474,,Pacific Arch closed through February 23,WWII,"The Pacific Arch will be closed for maintenance through Feb 23. During this time, pedestrian access to the memorial is through the Atlantic Arch or ceremonial entrance on 17th Street. The accessible entrance is via the Atlantic Arch.",Information,[],2023-01-17 11:03:34.0,0,World War II Memorial,World War II Memorial,DC,NC,WWII,
2608847B-13AF-44CE-B275-9144B94ACD3A,,1/15/2023 - Increasing Access to Visitor Center and Museum,COWP,"Beginning Sunday, Jan. 15, 2023, the visitor center at Cowpens NB will be open daily Wednesday to Sunday from 9:00 am to 5:00 pm. Restrooms and park grounds are open 7 days per week, except on federal holidays specified in the superintendent’s compendium.",Information,[],2023-01-15 08:47:42.0,0,Cowpens,National Battlefield,SC,SER,COWP,1.0
9F990027-3A96-42B4-9707-F03F36D6AD66,https://twitter.com/MCNPRoadsFerry,Green River Ferry Status,MACA,The Green River Ferry Status can change without advanced warning. For the most up-to-date ferry status information please call the Green River Ferry Hotline at (270) 758-2166 or follow the Mammoth Cave Roads and Ferry Twitter feed. 2 vehicle limit.,Information,[],2023-01-09 15:08:05.0,0,Mammoth Cave,National Park,KY,SER,MACA,1.0
8B0DE690-A1B9-4761-8DBC-2811F717586F,,The North Shoreline is Closed,FOPU,The shoreline is closed permanently for resource protection and visitor safety.,Information,[],2023-01-07 11:58:29.0,0,Fort Pulaski,National Monument,GA,SER,FOPU,1.0
7729B63A-1620-491A-B705-8269C375044D,,Walnut Canyon National Monument Hours and Trail Information,WACA,"Walnut Canyon is open daily from 9:00-5:00. The Island Trail is open from 9:00-4:00 and the Rim Trail is open from 9:00-4:30. Hikers must begin the trails before their closure times. There is no access to park trails, viewpoints or facilities after hours.",Information,[],2023-01-04 13:02:01.0,0,Walnut Canyon,National Monument,AZ,IMR,WACA,1.0
E91168E1-C430-437B-A372-CF55E0353895,,Visitor Center Closed Monday and Tuesday,GEWA,"The Visitor Center at George Washington Birthplace National Monument is closed on Mondays and Tuesdays. Park grounds are open daily 9:00 - 5:00 pm. On Mondays and Tuesdays, there are no tours of the Memorial House Museum.",Information,[],2023-01-04 12:16:05.0,0,George Washington Birthplace,National Monument,VA,NER,GEWA,1.0
5AA9D962-5565-4777-84C1-7CB400606F46,,South Cut trail Partially Closed,CUIS,South Cut Trail is closed between the main road and Killman Field trail due to washout along the trail. Detour for that section is along Killman Field trail. South Cut trail from Killman Field trail to the beach is open.,Danger,[],2022-12-22 12:15:18.0,1,Cumberland Island,National Seashore,GA,SER,CUIS,1.0
3B5FCE65-66E3-4020-AB3C-F0062E6A73F7,,Migrant Notice,DRTO,"Like elsewhere in the Florida Keys, we have recently seen an increase in Cuban migrants arriving by boat from Cuba and landing on the islands of Dry Tortugas National Park. You may observe migrant landings at the park and visitor areas may be impacted.",Information,[],2022-12-21 13:55:40.0,0,Dry Tortugas,National Park,FL,SER,DRTO,1.0
B11FDFA9-0555-4A58-B912-C21CA9D87687,,Masks are currently NOT REQUIRED when visiting Montezuma Castle National Monument,MOCA,Requirements are dependent upon Community Level and based on data provided by the Centers for Disease Control & Prevention (CDC) for counties where the park is located. Yavapai County is currently LOW and Masks are NOT REQUIRED inside Federal Buildings.,Information,[],2022-12-16 12:21:20.0,0,Montezuma Castle,National Monument,AZ,IMR,MOCA,1.0
