Column Labels,Park Alpha,Park Full Name,Park Name,Reg,State,Status,Type of Unit,category,date,description,park alpha,relatedRoadEvents,title
,WHSA,White Sands National Park,White Sands,IMR,NM,Only using alerts,National Monument,"['Information', 'Information']",2024-05-02,"['From time to time the missile range that surrounds the park performs military testing that may require the closure of the park or Highway 70. Please plan your visit around upcoming military tests.', 'There is limited space for parking for recreational vehicles and trailers in the parking lot directly in front (south) of the visitor center. RVs are asked to not park in the lot behind the visitor center. There is no parking space for tractor trailers.']",WHSA,"[[], []]","['Park Closures', 'RV and Tractor Trailer Parking at the Visitor Center']"
,ACAD,Acadia National Park,Acadia,NER,ME,Only using alerts,National Park,"['Park Closure', 'Park Closure', 'Park Closure']",2024-05-02,"[""Due to damage and unsafe conditions caused by recent storms, a staircase and access route from the Park Loop Road to Little Hunter's Beach is closed until further notice. Park staff are working to address issues there over coming weeks."", 'Jordan Pond Road is closed to through traffic as part of a bridge repair project. Stanley Brook Road will remain open to provide access the Jordan Pond area.', ""Acadia's historic carriage roads are now open only to pedestrians. They remain closed to all other uses, such has cycling and horses, to protect them during spring thaw, also known as “mud season.” Watch for further updates as conditions allow.""]",ACAD,"[[], [], []]","[""Staircase to Little Hunter's Beach closed until further notice"", 'Jordan Pond Road closed due to bridge repair project', 'Historic Carriage Roads open to pedestrians only']"
,CAHA,Cape Hatteras National Seashore,Cape Hatteras,SER,NC,Only using alerts,National Seashore,['Park Closure'],2024-05-02,"['The Buxton Beach Access, located at the end of Old Lighthouse Road in Buxton, and an adjacent three-tenths of a mile long stretch of beach, are temporarily closed due to petroleum contamination and remnant military infrastructure.']",CAHA,[[]],['Buxton Beach Access & Adjacent Beach Temporarily Closed']
,SEKI,Sequoia & Kings Canyon,Sequoia & Kings Canyon,PWR,CA,Only using alerts,National Parks,"['Park Closure', 'Information', 'Park Closure']",2024-05-02,"['Construction will cause periodic closures and traffic delays. During closures, vehicles cannot travel between the town of Three Rivers and Giant Forest or General Sherman Tree. For more information, including the closure schedule, click the ""more"" link:', 'Highway 245 outside the parks is under construction by CalTrans. It is scheduled to be closed through June 30, 2024. It is not possible to reach or leave the Grant Grove area using Highway 245. Alternate routes are available.', 'It is still winter in the mountains, and some roads remain under a seasonal closure. To see which roads are closed, click on the ""more"" link:']",SEKI,"[[], [], []]","['Periodic Weekday Closures on Generals Highway Between Three Rivers and Giant Sequoia Groves', 'Highway 245 is Closed for Construction and Cannot Be Used to Reach or Leave the Grant Grove Area', 'Some Winter Seasonal Road Closures Remain In Effect']"
,TAPR,Tallgrass Prairie National Preserve,Tallgrass Prairie,MWR,KS,Only using alerts,National Preserve,['Caution'],2024-05-02,"['Highway 177 is 60 mph with a blind spot directly across from the house. Safely use the highway underpass to the Fox Creek Trail just south of the visitor center parking lot. Be smart, stay alive.']",TAPR,[[]],['Dangerous Highway Crossing']
,GWMP,George Washington Memorial Parkway,George Washington,NCR,DC,Only using alerts,Memorial Parkway,['Park Closure'],2024-05-02,['The National Park Service is imposing a temporary closure of a portion of the Potomac Heritage National Trail crossing underneath Glebe Road Bridge during construction activities. This work is a subsect of the North Parkway rehabilitation.'],GWMP,[[]],['Potomac Heritage National Trail Closed at Glebe Road for construction activities']
,HOFU,Hopewell Furnace National Historic Site,Hopewell Furnace,NER,PA,Only using alerts,National Historic Site,['Information'],2024-05-02,"['Restoration of the parking lot East side of Route 345 (off Hopewell Rd) is anticipated to start this week.\xa0 No parking North of Hopewell Rd and slight trail & bridge diversions will be necessary during the project, anticipated to be completed Spring 2024.']",HOFU,[[]],['East Parking Lot Restoration']
,FOPO,Fort Point National Historic Site,Fort Point,PWR,CA,Only using alerts,National Historic Site,['Caution'],2024-05-02,"['You can prevent vehicle break-ins in parking lots and scenic overlooks. Before leaving your car for even a short period of time: 1) Remove all valuables, 2) Lock your doors. 3) Take your cell phones and electronics with you. Read article for more details.']",FOPO,[[]],['Auto-Theft Warning - Only Bring What You Need to the Park']
,HALE,Haleakala National Park,Haleakala,PWR,HI,Only using alerts,National Park,['Information'],2024-05-02,"['Nēnē (Hawaiian geese) and ʻuaʻu (Hawaiian petrel) are nesting in the park and may land on or frequent park roads, parking lots, and road leading up to the park. Drivers are reminded to drive at the posted speed limits and exercise caution.']",HALE,[[]],['Drive Cautiously - Endangered Birds on Roadway']
,GICL,Gila Cliff Dwellings National Monument,Gila Cliff Dwellings,IMR,NM,Only using alerts,National Monument,['Information'],2024-05-02,"['Pack it in, pack it out! There are no trash services in or around the monument. All food & trash must be secured inside a vehicle or hard sided containers. Ravens routinely open zipped bags & tear into trash bags left outside or in the bed of a truck.']",GICL,[[]],['Secure trash and food']
,PRSF,Presidio of San Francisco,Presidio,PWR,CA,Only using alerts,Presidio,['Caution'],2024-05-02,"['You can prevent vehicle break-ins in parking lots and scenic overlooks. Before leaving your car for even a short period of time: 1) Remove all valuables, 2) Lock your doors. 3) Take your cell phones and electronics with you. Read article for more details.']",PRSF,[[]],['Auto-Theft Warning - Only Bring What You Need to the Park']
,KAWW,Katahdin Woods and Waters National Monument,Katahdin Woods And Waters,NER,ME,Only using alerts,National Monument,"['Caution', 'Information', 'Park Closure']",2024-05-02,"['There is an impassable washout on the Seboeis Connector Road (46.07214,-68.63190) within the Seboeis Parcel of Katahdin Woods and Waters National Monument.', 'As of March 4, 2024, the gates on Swift Brook Road that are managed by Prentiss & Carlisle have been closed and locked. These privately owned roads are closed to vehicle traffic every spring during ""mud season"" to prevent road damage.', 'As of November 3, 2023, the North Entrance Road and the Katahdin View Loop Road are closed to wheeled vehicles for the winter season. Access by foot and bicycle is permitted.']",KAWW,"[[], [], []]","['Impassable Washout on Sebeois Connector Road', 'Swift Brook Road Gates Closed for Mud Season', 'North Entrance and Loop Roads Closed for the Winter Season']"
,CARL,Carl Sandburg Home National Historic Site,Carl Sandburg Home,SER,NC,Only using alerts,National Historic Site,['Caution'],2024-05-02,"['The pedestrian bridge at the main entrance to the park is closed. A 6-passenger accessible shuttle runs daily every 20 minutes from 9:40 am to 4:20 pm, from the main parking lot, on Little River Road, to the Sandburg Home and farm area.']",CARL,[[]],['Pedestrian Bridge at Front Lake is Closed']
,VAFO,Valley Forge National Historical Park,Valley Forge,NER,PA,Only using alerts,National Historical Park,"['Information', 'Information']",2024-05-02,"['Aqua removing trees on the north side of Rt 23 at Valley Creek in preparation for water main replacement project scheduled for autumn 2024. Tree removal will be completed prior to May 15. Vehicle and pedestrian traffic will continue as normal.', 'County Line Road is closed during the week, from Monday through Friday. The closure will apply to all vehicular, pedestrian, and bicycle traffic. Please find an alternate route.']",VAFO,"[[], []]","[""Tree Removal Work on Rt 23 at Valley Creek near Washington's Headquarters"", 'County Line Road Closed Monday To Friday']"
,GLAC,Glacier National Park,Glacier,IMR,MT,Only using alerts,National Park,['Park Closure'],2024-05-02,['The alpine section of the Going-to-the-Sun Road is closed for the season. Specific closure locations are dependent on plowing progress.'],GLAC,[[]],['Going-to-the-Sun Road Seasonal Closure']
,GOGA,Golden Gate National Recreation Area,Golden Gate,PWR,CA,Only using alerts,National Recreation Area,"['Park Closure', 'Information', 'Information', 'Caution']",2024-05-02,"['As part of an ongoing rehabilitation project, the lot will be closed for asphalt paving. Beach access will remain open with possible brief delays to allow construction vehicles to navigate the site. Work may be completed early (end of day Thursday).', 'Due to previous storm damage, the trail has been closed until the park can re-route it to a better location. Until construction of a re-route is complete, the trail will be closed.', 'Northwest portion of the parking lot off of Bunker Road in Marin Headlands will be temporarily closed. Stay out of the closure and park in the other parking spaces.', 'You can prevent vehicle break-ins in parking lots and scenic overlooks. Before leaving your car for even a short period of time: 1) Remove all valuables, 2) Lock your doors. 3) Take your cell phones and electronics with you. Read article for more details.']",GOGA,"[[], [], [], []]","['China Beach parking lot closed for paving on Thursday, May 2 & Friday, May 3', 'Phleger Estate Miramontes Trail Closed for Public Safety January 2022 Until Trail is Replaced', 'Smith Road Trailhead Parking Lot Temporary Partial Closure April 8 - June 30, 2024', 'Auto-Theft Warning - Only Bring What You Need to the Park']"
,PINE,New Jersey Pinelands National Reserve,New Jersey Pinelands,NER,NJ,Only using alerts,National Reserve,[''],2024-05-02,"[""You were redirected to this site from the New Jersey Coastal Heritage Trail Route because of a sunset clause in the Trail's federal legislation, the NPS lost its legislative authority to manage the trail after 9-30-2011.""]",PINE,[[]],['If you have been redirected from the New Jersey Coastal Heritage Trail Route']
,JOTR,Joshua Tree National Park,Joshua Tree,PWR,CA,Only using alerts,National Park,['Caution'],2024-05-02,"['Desert tortoises are active in the spring and will sometimes cross the road. Please drive cautiously and obey the speed limit. To learn more about this iconic species, why they are threatened today, and what to do if you see one, click the link below.']",JOTR,[[]],['Watch Out for Tortoises on the Road']
,SAGA,Saint-Gaudens National Historical Park,Saint-Gaudens,NER,NH,Only using alerts,National Historic Site,['Information'],2024-05-02,"['The floodplain forest between the Connecticut River and NH Route 12A, north of the Blow-Me-Down Brook and forested areas on either side of Saint-Gaudens Road are closed to prevent damage from fiddlehead poaching during the months of April and May.']",SAGA,[[]],['Seasonal closure of certain areas to prevent poaching']
,NIOB,Niobrara National Scenic River,Niobrara,MWR,NE,Only using alerts,National Scenic River,['Information'],2024-05-02,['The highway 137 bridge landing sustained flood damage in 2019 and the landing restoration by NDOT has been completed. The area is smaller than in the past and the access to the water is steeper. Use caution when accessing the landing'],NIOB,[[]],['Landing at Hwy 137']
,IATR,Ice Age National Scenic Trail,Ice Age,MWR,WI,Only using alerts,National Scenic Trail,['Information'],2024-05-02,"['Trail conditions can vary throughout the state. Before heading out, check the trail conditions, potential re-routes and closures on the Ice Age Trail Alliance website.']",IATR,[[]],['Trail Conditions']
,BICA,Bighorn Canyon National Recreation Area,Bighorn Canyon,IMR,"MT,WY",Only using alerts,National Recreation Area,['Information'],2024-05-02,['Road construction in the park from April 1 to mid-August 2024. Weekly updates on construction activities and locations in the park will be posted on the Bighorn Canyon Facebook page. Visitors can also call 307-548-5406 for current conditions.'],BICA,[[]],['Road Construction Delays April 1 to Mid-August 2024']
,COLM,Colorado National Monument,Colorado,IMR,CO,Only using alerts,National Monument,['Caution'],2024-05-02,['Project work runs from 4/2- 8/5. There will be delays of up to 15 minutes and occasional road closures between DS Rd and Independence Monument View. Visit the project page for a full work schedule.'],COLM,[[]],['Resurfacing Rim Rock Drive']
,CUGA,Cumberland Gap National Historical Park,Cumberland Gap,SER,"KY, TN, VA",Only using alerts,National Historical Park,['Information'],2024-05-02,['Wilderness Road is closed from Tennessee Road Trail to the trail that leads up to Gap Cave for scheduled maintenance work.'],CUGA,[[]],['Trail Closure']
,LARO,Lake Roosevelt National Recreation Area,Lake Roosevelt,PWR,WA,Only using alerts,National Recreation Area,['Park Closure'],2024-05-02,"['Due to undercutting action of Hawk Creek on the access road between the Hawk Creek campground and boat launch, the road will be reduced to one lane until further notice. Use caution while on this road.']",LARO,[[]],['Hawk Creek Lane Restriction at Lake Roosevelt National Recreation Area']
,DEPO,Devils Postpile National Monument,Devils Postpile,PWR,CA,Only using alerts,National Monument,"['Park Closure', 'Park Closure']",2024-05-02,"['Reds Meadow Road and shuttle service, which provide access to Devils Postpile National Monument, will be closed 24 hours per day for construction work from Sundays at 11 pm through Fridays at 9 am (excluding holidays) during the summer 2024 season.', 'Devils Postpile National Monument and Reds Meadow Road are closed for season; they will not reopen before June 2024.']",DEPO,"[[], []]","['Reds Meadow Road Access Restrictions in 2024', 'Devils Postpile National Monument is closed']"
,CHIR,Chiricahua National Monument,Chiricahua,IMR,AZ,Only using alerts,National Monument,['Information'],2024-05-02,"[""Vehicles longer than 24 feet are not permitted past the visitor center on Bonita Canyon Drive. Vehicles up to 29 feet are still allowed to stay in the campground, but can't go further. Parking for large vehicles and trailers is available at Faraway Ranch.""]",CHIR,[[]],['Vehicle Length Limits']
,ALCA,Alcatraz Island,Alcatraz Island,PWR,CA,Only using alerts,Island,['Caution'],2024-05-02,"['You can help prevent vehicle break-ins in parking lots. Before leaving your car to catch the ferry: 1) Remove all valuables, 2) Lock your doors. 3) Take your cell phones and electronics with you. Read article for more details.']",ALCA,[[]],['Auto-Theft Warning - Only Bring What You Need to the Park']
,ANJO,Andrew Johnson National Historic Site,Andrew Johnson,SER,TN,Only using alerts,National Historic Site,['Caution'],2024-05-02,"['Due to the narrow roadway & tight turn, RVs, mobile homes, charter buses, delivery trucks, or vehicles with trailers are prohibited from the crest of Monument Hill. Check for information about parking at the Visitor Center upon your arrival.']",ANJO,[[]],['Notice to travelers to National Cemetery']
,CARE,Capitol Reef National Park,Capitol Reef,IMR,UT,Only using alerts,National Park,"['Park Closure', 'Park Closure']",2024-05-02,"['Expect heavy truck traffic this week. Effective May 6, 2024, the Scenic Drive will close from just south of the Grand Wash Road to Capitol Gorge. Starting May 13, the Scenic Drive south of the campground will close. Most of the park remains accessible.', 'The following are closed to the public through 8/31/2024 to protect sensitive resources: the heads of Burro Wash & Fivemile Wash continuing east 2 miles, Shinob Canyon and any route descending into Shinob, including Na-gah, Nighthawk, & Timpie.']",CARE,"[[], []]","['Scenic Drive Rehabilitation Project', 'Seasonal Canyon Closures']"
,FOWA,Fort Washington Park,Fort Washington,NCR,MD,Only using alerts,Park,['Park Closure'],2024-05-02,['The Service Road/Trail from the Lighthouse parking lot toward the lighthouse and the road between the fort and visitor center hills are closed to due scheduled construction of the roadway. Please do not enter the area.'],FOWA,[[]],['Service Road Closure']
,LAVO,Lassen Volcanic National Park,Lassen Volcanic,PWR,CA,Only using alerts,National Park,"['Park Closure', 'Caution']",2024-05-02,"['Lassen National Park Highway connecting the north and south park entrances is CLOSED to vehicles. Vehicles can still access two park entrances. One at the northwest and the other at the southwest entrances throughout the snow season. Learn more.', 'Inclement weather may cause unexpected delays, closures and possibly hazardous road conditions. The visitor center phone line may be unavailable.']",LAVO,"[[], []]","['Lassen National Park Highway is CLOSED for the season', 'Changing conditions']"
,CEBR,Cedar Breaks National Monument,Cedar Breaks,IMR,UT,Only using alerts,National Monument,['Park Closure'],2024-05-02,"['Visitors can access the park via Highway 143 and the town of Brian Head. You can view Cedar Breaks from the Northview Overlook. State Route 143 will remain open, weather permitting. On April 22, the seasonal snowmobile trail will close.']",CEBR,[[]],['State Route 148 closed for the winter season']
,VICK,Vicksburg National Military Park,Vicksburg,SER,MS,Only using alerts,National Military Park,"['Park Closure', 'Park Closure']",2024-05-02,"['Louisiana Circle is closed to vehicles and pedestrians due to slope instability. Navy Circle is open and also provides views of the Mississippi River.', ""Due to weather related incidents, North Union Avenue and Grant's Circle are closed to vehicular and recreational traffic. Entering these areas is prohibited. A portion of Grant Avenue is open for touring.""]",VICK,"[[], []]","['Louisiana Circle Closed', ""North Union Avenue and Grant's Circle Closed""]"
,YORK,Yorktown Battlefield,Yorktown,NER,VA,Only using alerts,Battlefield,['Park Closure'],2024-05-02,"['Beginning Tuesday, April 9, 2024, construction will close the Colonial Parkway to all travel in either direction between Yorktown and VA Route 199. Follow all detour signs. See additional closure information in the link below.']",YORK,[[]],['Rehabilitation of Colonial Parkway continues with additional Parkway closures']
,FONE,Fort Necessity National Battlefield,Fort Necessity,NER,PA,Only using alerts,National Battlefield,['Information'],2024-05-02,['Portions of the Braddock Road Trail at the Indian Run bridge are closed until a new foot bridge is constructed.'],FONE,[[]],['Portions of Braddock Road Trail Closed']
,HOCU,Hopewell Culture National Historical Park,Hopewell Culture,MWR,OH,Only using alerts,National Historical Park,['Caution'],2024-05-02,"['Scheduled bridge replacement on Hopetown Road will impact visitor use at the Hopeton Earthworks parking lot. The parking lot will not be accessible to foot or vehicle traffic starting Sunday, May 5 thru at least May 11. Contact the park for more info.']",HOCU,[[]],['Bridge Replacement on Hopetown Rd. to Affect Access to Hopeton Earthworks']
,HAFO,Hagerman Fossil Beds National Monument,Hagerman Fossil Beds,PWR,ID,Only using alerts,National Monument,['Caution'],2024-05-02,"['The new visitor center is located at 17970 US Hwy 30, about one mile north of downtown Hagerman and the old visitor center. Highway signs and GPS navigation may not yet be up-to-date.']",HAFO,[[]],['Use Caution with GPS Navigation']
,GRCA,Grand Canyon National Park,Grand Canyon,IMR,AZ,Only using alerts,National Park,['Park Closure'],2024-05-02,['The Visitor Center is CLOSED May 1 through May 4 for staff training. Visit the link for available visitor services/hours of operation. The North Rim of the park and SR 67 remain CLOSED to all vehicle traffic until May 15.'],GRCA,[[]],"[""What's Closed and What's Open? (Park Operational Updates) Thursday, May 2, 2024""]"
,CUIS,Cumberland Island National Seashore,Cumberland Island,SER,GA,Only using alerts,National Seashore,['Danger'],2024-05-02,['South Cut Trail is closed between the main road and Killman Field trail due to washout along the trail. Detour for that section is along Killman Field trail. South Cut trail from Killman Field trail to the beach is open.'],CUIS,[[]],['South Cut trail Partially Closed']
,MEVE,Mesa Verde National Park,Mesa Verde,IMR,CO,Only using alerts,National Park,['Information'],2024-05-02,['Spring weather is variable at Mesa Verde. Snow and ice can delay opening the main park road. Trails often become muddy or closed due to rain or late snow melt. Current info is available at the Visitor and Resource Center. Click the link below for update'],MEVE,[[]],['Spring Conditions']
,CRMO,Craters of the Moon National Monument and Preserve,Craters Of The Moon,PWR,ID,Only using alerts,National Monument & Preserve,['Caution'],2024-05-02,['Please do not rely upon GPS digital navigation systems to find your way to Craters of the Moon. Please note that the Visitor Center at 1266 Craters Loop Road is located just off U.S. Highway 20/26/93 and is not accessed via any unpaved roads.'],CRMO,[[]],['Navigation']
,MIMA,Minute Man National Historical Park,Minute Man,NER,MA,Only using alerts,National Historical Park,['Park Closure'],2024-05-02,['Battle Road Trail between Olive Stow Boardwalk to Shadyside Avenue and Lexington Road is closed until late Spring 2024. This will allow for the completion of a trail re-route. Entering closures is prohibited. Please plan accordingly.'],MIMA,[[]],['Trail Closures on Battle Road Trail']
,CAVE,Carlsbad Caverns National Park,Carlsbad Caverns,IMR,NM,Only using alerts,National Park,['Information'],2024-05-02,"['Recent flooding has caused major damage to the road. It is unknown when repairs will begin or the length of time to complete. The main park road to the visitor center and cavern is open. For updates on the road and trails, click ""More"" below.']",CAVE,[[]],['Walnut Canyon Desert Drive Closed Due to Flood Damage']
,FIIS,Fire Island National Seashore,Fire Island,NER,NY,Only using alerts,National Seashore,['Information'],2024-05-02,"['During the month of April, a section of boardwalk near Sailors Haven marina will be inaccessible due to repair work. Visitors walking the trail should use the west end trail entrances and walk an out-and-back route, as loop walks will not be possible.']",FIIS,[[]],['Sections of Sunken Forest Boardwalk Inaccessible During Repair Work']
,EVER,Everglades National Park,Everglades,SER,FL,Only using alerts,National Park,"['Park Closure', 'Caution', 'Caution']",2024-05-02,"['Roads to the park have delays from construction and Shark Valley parking lot is regularly filling to capacity from 10 a.m. to 3 p.m. with wait times of up to 2 hours.', 'Roadwork is underway along State Road 9336 leading to the Homestead entrance of the park, approaching the Ernest F. Coe Visitor Center. Drivers may experience short delays and should watch for personnel, construction equipment, and slowdowns.', ""Current roadwork is ongoing along the park's northern boundary on US Highway 41/Tamiami Trail to raise the road for Everglades Restoration benefits. Drivers may experience up to 15-minute delays and should watch for personnel, equipment and slow downs.""]",EVER,"[[], [], []]","['Click on ""caution"" alerts below for important details on accessing the park', ""Road construction on approach to park's Homestead entrance"", 'Roadwork may cause delays on US 41/Tamiami Trail']"
,PISC,Piscataway Park,Piscataway,NCR,MD,Only using alerts,Park,['Information'],2024-05-02,['The Marshall Hall Access Road is closed due to construction. This road connects the Marshall Hall ruins to Marshall Hall Rd. The main road remains open.'],PISC,"[[{'title': 'Marshall Hall Access Road', 'id': '4BA1081E-8201-42D7-AB10-4950BCCB893C', 'type': 'roadevent', 'url': 'https://www.nps.gov/pisc/planyourvisit/conditions.htm'}]]",['Road Closure: Marshall Hall Access Road']
,CACO,Cape Cod National Seashore,Cape Cod,NER,MA,Only using alerts,National Seashore,"['Park Closure', 'Park Closure']",2024-05-02,"[""The Marconi Beach stairs will be demo'ed and replaced between 4/30-5/23 and will reopen for Memorial Day weekend. For public safety and to allow the contractor to work unimpeded, the entrance road and parking area will be closed for the duration."", 'Between 3/11-5/18, the Pilgrim Heights parking area and access roadways in Truro will be temporarily closed to allow for repaving and survey work. 24-hour vehicle and pedestrian closures will be in place during this time.']",CACO,"[[], []]","['Marconi Stairs/Beach Closed 4/30-5/23', 'Pilgrim Heights Parking Area and Access Closed 3/11-5/18']"
,MABI,Marsh-Billings-Rockefeller National Historical Park,Marsh - Billings - Rockefeller,NER,VT,Only using alerts,National Historical Park,['Information'],2024-05-02,['Four miles of trail along the carriage road corridors have been designated as ‘Multi-Use Trails’ in winter – walkers are permitted to use these trails free of charge. All other trails require a day/season pass from the Woodstock Inn. See link for details.'],MABI,[[]],['Select Trails Require Day Use Pass from Woodstock Inn & Resort Nordic Center']
