Column Labels,Park Alpha,Park Full Name,Park Name,Reg,State,Status,Type of Unit,category,date,description,park alpha,relatedRoadEvents,title
,BLRI,Blue Ridge Parkway,Blue Ridge,SER,"NC,VA",Using TDx feed and alerts,Parkway,"['Park Closure', 'Information', 'Information', 'Information', 'Information', 'Park Closure']",2024-07-02,"['Road closed to all activity for replacement of 3 bridges. Detour in place via NC 18 to the NC/VA line near milepost 217.3. Access to Doughton Park, including the campground and Bluffs Restaurant, is available via NC 18.', 'Single lane closure possible with reduced speed for paving work. Bicyclists and motorcyclists are advised to find alternative routes while pavement is curing due to hazardous conditions from loose gravel.', 'Single lane closure possible with reduced speed for paving work. Bicyclists and motorcyclists are advised to find alternative routes while pavement is curing due to hazardous conditions from loose gravel.', 'Single lane closure possible with reduced speed for paving work. Bicyclists and motorcyclists are advised to find alternative routes while pavement is curing due to hazardous conditions from loose gravel.', 'Single lane closure possible for road paving and infrastructure repairs. Access to Doughton Park, including the campground and Bluffs Restaurant is available via NC 18.', 'Road closed to all activity for Laurel Fork Bridge replacement. Detour in place from MP 248 (NC 18) to MP 249 (Northwest Trading Post).']",BLRI,"[[{'title': 'MP 221.8 - MP 229.5 Bridge Construction', 'id': 'E185319B-0775-4E70-871E-BE6E3765BB13', 'type': 'roadevent', 'url': 'https://www.nps.gov/blri/planyourvisit/conditions.htm'}], [{'title': 'MP 89.1 - MP 97.2 Pavement Preservation', 'id': 'EF0E882D-CCB6-4F45-9779-E59064328E73', 'type': 'roadevent', 'url': 'https://www.nps.gov/blri/planyourvisit/conditions.htm'}], [{'title': 'MP 64.6 - MP 86.2 Pavement Preservation', 'id': 'F7326A8B-AF2E-4723-A0C6-B30424A3FBD9', 'type': 'roadevent', 'url': 'https://www.nps.gov/blri/planyourvisit/conditions.htm'}], [{'title': 'MP 27.3 - MP 37.6 Pavement Preservation', 'id': '13D7EE8B-47E6-4594-8012-B08DEDCBD862', 'type': 'roadevent', 'url': 'https://www.nps.gov/blri/planyourvisit/conditions.htm'}], [{'title': 'MP 238.5 - MP 248 Road Construction', 'id': '9C351538-9DC3-4586-8B55-2F592C9D3AB8', 'type': 'roadevent', 'url': 'https://www.nps.gov/blri/planyourvisit/conditions.htm'}], [{'title': 'MP 248 - MP 249 Bridge Construction', 'id': 'AB5E8A6A-055C-4A2C-A11F-89B06AB41160', 'type': 'roadevent', 'url': 'https://www.nps.gov/blri/planyourvisit/conditions.htm'}]]","['MP 221.8 - MP 229.5 Bridge Construction', 'MP 89.1 - MP 97.2 Pavement Preservation', 'MP 64.6 - MP 86.2 Pavement Preservation', 'MP 27.3 - MP 37.6 Pavement Preservation', 'MP 238.5 - MP 248 Road Construction', 'MP 248 - MP 249 Bridge Construction']"
,BLCA,Black Canyon of the Gunnison National Park,Black Canyon Of The Gunnison,IMR,CO,Using TDx feed and alerts,National Park,"['Park Closure', 'Park Closure', 'Information', 'Caution']",2024-07-02,"['One-lane of the U.S. 50 Middle Bridge will open starting Wednesday, July 3 at 6:30 am. Pilot cars will lead smaller vehicles across the bridge one direction at a time between 6:30 am and 6:30 pm each day through Sunday, July 7. Access will change July 8.', 'Phase one of this major road improvement project is underway with alternating one-way traffic (expect 15-minute delays, multiple stops) starting at the park entrance on Hwy 347.', 'Road construction starts May 13, 2024, with alternating one-way closures Mon-Fri 8:00am-6:30pm. The project is located on US Highway 50 between mileposts 123 and 127, approx. 30 miles east of Montrose, CO. Refer to www.us50info.com for updated information', 'Major road improvement projects will impact the park from April-November 2024. Expect delays, alternating one-way traffic, and parking lot closures from the park boundary on Hwy 347 to the visitor center. Drive with extra caution. More road work in 2025.']",BLCA,"[[], [], [], [{'title': 'South Rim Road Construction', 'id': '75883C21-B99F-44AB-A551-DDBAD3306156', 'type': 'roadevent', 'url': 'https://www.nps.gov/blca/planyourvisit/conditions.htm'}]]","['Limited Opening of U.S. Highway 50 Middle Bridge from July 3-7 - East of Black Canyon', 'Road Construction Update - Delays and Closures in Effect', 'Highway 50 - Little Blue Creek Canyon Construction', 'Road Construction at Black Canyon South Rim - 2024 and 2025']"
,ORPI,Organ Pipe Cactus National Monument,Organ Pipe Cactus,IMR,AZ,Using TDx feed and alerts,National Monument,"['Park Closure', 'Park Closure', 'Caution']",2024-07-02,"['The border roads remain closed (the dirt roads directly along the border and all crossover roads leading from South Puerto Blanco Drive to the border) to all public vehicle and pedestrian traffic for public safety. South Puerto Blanco Drive remains open.', 'El Camino De Dos Republicas remains open from SR85 to Gachado Line Camp. Dos Lomitas is not accessible. The southeast border road from Lukeville Port of Entry eastward to the Santa Rosa Mountains is closed to public vehicle and pedestrian traffic.', 'High Clearance, 4-wheel drive is required from where Pozo Nuevo Road begins along South Puerto Blanch Drive to Bates Well Ranch area. The road is washed out in areas. Bates Well Ranch is still accessible from the north on Darby Well Road.']",ORPI,"[[], [{'title': 'Gachado to Dos Lomitas Closure', 'id': '26FB2023-E141-4E46-A913-0E0996048633', 'type': 'roadevent', 'url': 'https://www.nps.gov/orpi/planyourvisit/conditions.htm'}], []]","['West and East Border Roads closed for public safety', 'Gachado Line Camp open. Southeast border road and access roads closed', 'Pozo Nuevo Road to Bates Well Ranch High Clearance, 4-Wheel Drive Only']"
,GRSM,Great Smoky Mountains National Park,Great Smoky Mountains,SER,"TN,NC",Using TDx feed and alerts,National Park,"['Park Closure', 'Information', 'Park Closure']",2024-07-02,"['Cades Cove Loop Road is motor vehicle-free all day on Wednesdays from May through September to provide opportunities for cyclists and pedestrians to experience Cades Cove without motor vehicles.', 'All vehicles parking for longer than 15 minutes require a parking tag. Three tag durations are available for purchase for all vehicle sizes and types: Daily ($5), Weekly ($15), or Annual ($40).', 'Several trails in the park are temporarily closed. Please check the ""Trail and Backcountry Closures, Warnings & Cautions"" section of the Current Road, Facility, Trail & Backcountry Updates page for further details.']",GRSM,"[[], [], []]","['Cades Cove closed Wednesdays to motor vehicles', 'Most visitors need a parking tag', 'Trail Advisory']"
,CARE,Capitol Reef National Park,Capitol Reef,IMR,UT,Using TDx feed and alerts,National Park,['Park Closure'],2024-07-02,"['The following are closed to the public through 8/31/2024 to protect sensitive resources: the heads of Burro Wash & Fivemile Wash continuing east 2 miles, Shinob Canyon and any route descending into Shinob, including Na-gah, Nighthawk, & Timpie.']",CARE,[[]],['Seasonal Canyon Closures']
,MOJA,Mojave National Preserve,Mojave,PWR,CA,Using TDx feed and alerts,National Preserve,"['Park Closure', 'Danger', 'Information']",2024-07-02,"['Black Canyon Rd. near Mid Hills will be closed to through traffic on 6.22.2024 due to road construction.', 'Hart Mine Road is missing several wooden culverts the burned in the 2023 York Fire. The road may appear intact but could cave in under the weight of a vehicle. Stay off of Hart Mine Road for your safety.', 'Mojave National Preserve Road Crews will be repairing a problematic low water crossing ~2 miles north of the Junction of Cedar Canyon Road. Minor Delays are expected.']",MOJA,"[[], [{'title': 'Hart Mine Road', 'id': '09EAF34E-7380-4129-A04E-4F3AF013E1BD', 'type': 'roadevent', 'url': 'https://www.nps.gov/moja/planyourvisit/conditions.htm'}], [{'title': 'Ivanpah Low Water Crossing Repair', 'id': 'DEC80F3F-5E36-4E09-9DA3-1B74F93163D1', 'type': 'roadevent', 'url': 'https://www.nps.gov/moja/planyourvisit/conditions.htm'}]]","['Black Canyon Road Closure 06.22.2024', 'Hart Mine Road Closed due to dangerous potential for collapse', 'Ivanpah Road Repairs - Traffic Subject to minor delays']"
,DESO,De Soto National Memorial,De Soto,SER,FL,Using TDx feed and alerts,National Memorial,['Caution'],2024-07-02,"[""The Park's parking lot, access road, and surrounding areas will be closed. All visitor access will be prohibited due to construction safety. Visitors will gain access to visitor center and trails through Riverview Point Preserve located next door.""]",DESO,"[[{'title': 'Parking Lot Construction', 'id': '660D3C26-0716-4081-808A-4A8D79BE0422', 'type': 'roadevent', 'url': 'https://www.nps.gov/deso/planyourvisit/conditions.htm'}]]",['Parking Lot and Surrounding Area CLosed for Construction July 8 through August 28.']
,GUMO,Guadalupe Mountains National Park,Guadalupe Mountains,IMR,TX,Using TDx feed and alerts,National Park,"['Information', 'Caution']",2024-07-02,"['The Williams Ranch Road is currently impassable and closed to public access due to unsafe conditions.', ""The hike to Devil's Hall is rated as strenuous. The portion of the route in the wash requires rock scrambling and is dangerous when wet or if water is present. The wash surface is loose gravel and rocks and may be unstable.""]",GUMO,"[[{'title': 'Williams Ranch Road Closure', 'id': 'E22F9CF8-0208-4993-A8B3-C3E25406C972', 'type': 'roadevent', 'url': 'https://www.nps.gov/gumo/planyourvisit/conditions.htm'}], []]","['Williams Ranch Road Closed', ""Devil's Hall is a Strenuous Hike""]"
,SHEN,Shenandoah National Park,Shenandoah,NER,VA,Using TDx feed and alerts,National Park,"['Information', 'Information', 'Information']",2024-07-02,"['Closed to vehicular traffic.', 'Closed to vehicular traffic.', ""The boundary access to Jeremy's Run Trail across private property at State Route 611 is temporarily closed by the landowner. The park trail remains open. Hikers must access Jeremy's Run from Skyline Drive. The park is working to resolve the situation.""]",SHEN,"[[{'title': 'Red Gate Fire Road', 'id': 'B7AF53DA-FA44-4743-B579-FF81CB68EE33', 'type': 'roadevent', 'url': 'https://www.nps.gov/shen/planyourvisit/conditions.htm'}], [{'title': 'Tanners Ridge Fire Road', 'id': 'C509E46A-FE91-4AE4-9D13-9ECFEFC2F89D', 'type': 'roadevent', 'url': 'https://www.nps.gov/shen/planyourvisit/conditions.htm'}], []]","['Red Gate Fire Road', 'Tanners Ridge Fire Road', ""Jeremy's Run Trail from the boundary""]"
,CURE,Curecanti National Recreation Area,Curecanti,IMR,CO,Using TDx feed and alerts,National Recreation Area,"['Park Closure', 'Information']",2024-07-02,"['One-lane of the U.S. 50 Middle Bridge will open starting Wednesday, July 3 at 6:30 am. Pilot cars will lead smaller vehicles across the bridge one direction at a time between 6:30 am and 6:30 pm each day through Sunday, July 7. Access will change July 8.', 'One lane will be closed for roadwork with alternating traffic Mondays through Fridays from 8am to 6:30pm. No weekend work is planned. Westbound traffic will experience longer delays between noon and 1pm, so plan accordingly. Wait times will vary.']",CURE,"[[{'title': 'U.S. 50 Middle Bridge Limited Opening', 'id': 'D1FDC7BE-4819-4F4B-A028-F1F3AE691F49', 'type': 'roadevent', 'url': 'https://www.nps.gov/cure/planyourvisit/conditions.htm'}], [{'title': 'Little Blue Creek Canyon Construction', 'id': '3949A0BC-9FC3-483A-892A-52B73482783A', 'type': 'roadevent', 'url': 'https://www.nps.gov/cure/planyourvisit/conditions.htm'}]]","['Limited Opening of U.S. Highway 50 Middle Bridge from July 3-7, 2024', 'US 50 Roadwork - Little Blue Creek Canyon']"
,BUFF,Buffalo National River,Buffalo,MWR,AR,Using TDx feed and alerts,National River,"['Park Closure', 'Information', 'Information']",2024-07-02,"['In the interest of safety, the South Woolum Road has been closed. The Woolum launch and campground remain open.', 'Parking will no longer be permitted on the road to allow space for emergency vehicles to safely enter the park. There will be ‘No Parking’ signs placed along the Kyles Landing Road, also known as County Road 56.', 'The Spring Creek Landing has been closed to vehicle-assisted launches. Watercraft may still be put in and take out at this point, but must be hand carried to and from the parking area. This is to ensure the safety of visitors and avoid continued erosion.']",BUFF,"[[{'title': 'South Woolum Road Closure', 'id': '83A17F44-C295-4B5D-82F4-C770BDB1CD1A', 'type': 'roadevent', 'url': 'https://www.nps.gov/buff/planyourvisit/conditions.htm'}], [], []]","['South Woolum Road Closed, Alternate Route Available', 'Parking is not permitted on the Kyles Landing Road (County Road 56)', 'Spring Creek Landing Closed to Vehicle-Assisted Launches']"
,OZAR,Ozark National Scenic Riverways,Ozark,MWR,MO,Using TDx feed and alerts,National Scenic Riverways,['Caution'],2024-07-02,['The Akers Ferry on State Highway K will not be in service until further notice.'],OZAR,"[[{'title': 'Akers Ferry Closure', 'id': 'B6DEFC30-C21C-4E29-A626-5FFCEA446EA8', 'type': 'roadevent', 'url': 'https://www.nps.gov/ozar/planyourvisit/conditions.htm'}]]",['River Ferry at Akers (on State Highway K) CLOSED until further notice']
,CUGA,Cumberland Gap National Historical Park,Cumberland Gap,SER,"KY, TN, VA",Only using alerts,National Historical Park,['Information'],2024-07-02,['Wilderness Road is closed from Tennessee Road Trail to the trail that leads up to Gap Cave for scheduled maintenance work.'],CUGA,[[]],['Trail Closure']
,CUVA,Cuyahoga Valley National Park,Cuyahoga Valley,MWR,OH,Only using alerts,National Park,[''],2024-07-02,"['Towpath Trail will be closed for repairs starting at Station Road and extending 2,500 feet north from 7 a.m. and 5 p.m, weekdays. No detour is provided. The anticipated opening date is late January. Towpath will remain open southbound from Station Road.']",CUVA,[[]],['Towpath Trail Temporary Closure']
,DEPO,Devils Postpile National Monument,Devils Postpile,PWR,CA,Only using alerts,National Monument,['Park Closure'],2024-07-02,"['Reds Meadow Road & shuttle service, which provide access to Devils Postpile, will be closed for construction from Sundays at 11 pm through Fridays at 9 am (except holidays) during the summer 2024 season. The road also closes Fridays starting September 15.']",DEPO,[[]],['Reds Meadow Road Access Restrictions in 2024']
,NIOB,Niobrara National Scenic River,Niobrara,MWR,NE,Only using alerts,National Scenic River,['Information'],2024-07-02,['The highway 137 bridge landing sustained flood damage in 2019 and the landing restoration by NDOT has been completed. The area is smaller than in the past and the access to the water is steeper. Use caution when accessing the landing'],NIOB,[[]],['Landing at Hwy 137']
,ANAC,,,,,Only using alerts,,,2024-07-02,,,,
,FOMC,Fort McHenry National Monument and Historic Shrine,Fort McHenry,NER,MD,Only using alerts,National Monument and Historic Shrine,['Information'],2024-07-02,"['For the safety and protection of visitors and park resources, motorized scooters are not permitted within the park. Any vehicles (scooters, bicycles, etc.) that are part of a ride-share program may not be left behind for pick up inside the park']",FOMC,[[]],['Motorized Recreational Scooters Not Permitted in Park']
,APPA,Appalachian,Appalachian,NER,"CT,GA,MA,MD,ME,NC,NH,NJ,NY,PA,TN,VA,VT,WV",Only using alerts,National Scenic Trail,['Park Closure'],2024-07-02,"['McAfee Knob/Route 311 parking area along the A.T. in Catawba will be closed Thursday, November 30. The lot is being closed to allow for the construction of a new pedestrian footbridge over Route 311.']",APPA,[[]],['CENTRAL VA – PARKING LOT CLOSURE– ROUTE 311/MCAFEE KNOB']
,VOYA,Voyageurs National Park,Voyageurs,MWR,MN,Only using alerts,National Park,['Park Closure'],2024-07-02,"[""Salmi Road entrance to the Kab-Ash Trail remains temporarily closed at the trail's western most terminus. Access to the trail remains open at trailheads along Ash River Trail road, Meadwood Road, and the eastern terminus within the community of Ash River.""]",VOYA,[[]],['Salmi Road Entrance to the Kab-Ash Trail out of the Kabetogama Community Remains Temporarily Closed.']
,BADL,Badlands National Park,Badlands,MWR,SD,Only using alerts,National Park,['Caution'],2024-07-02,"['Do not rely on GPS digital navigation systems to find your way to Badlands National Park. Please note that the Visitor Center at 25216 Ben Reifel Road, Interior SD 57750 is located just off I-90.']",BADL,[[]],['Navigation']
,BICA,Bighorn Canyon National Recreation Area,Bighorn Canyon,IMR,"MT,WY",Only using alerts,National Recreation Area,['Information'],2024-07-02,['Road construction in the park from April 1 to mid-August 2024. Weekly updates on construction activities and locations in the park will be posted on the Bighorn Canyon Facebook page. Visitors can also call 307-548-5406 for current conditions.'],BICA,[[]],['Road Construction Delays April 1 to Mid-August 2024']
,SAGU,Saguaro National Park,Saguaro,IMR,AZ,Only using alerts,National Park,['Caution'],2024-07-02,"[""Saguaro National Park is an urban park. Vehicle break-ins have occurred at trailheads around the park. Don't make yourself a target. Leave valuables at home, secure your vehicle, and report any suspicious activity.""]",SAGU,[[]],['Vehicle Break-Ins']
,TAPR,Tallgrass Prairie National Preserve,Tallgrass Prairie,MWR,KS,Only using alerts,National Preserve,['Caution'],2024-07-02,"['Highway 177 is 60 mph with a blind spot directly across from the house. Safely use the highway underpass to the Fox Creek Trail just south of the visitor center parking lot. Be smart, stay alive.']",TAPR,[[]],['Dangerous Highway Crossing']
,MACA,Mammoth Cave National Park,Mammoth Cave,SER,KY,Only using alerts,National Park,"['Information', 'Caution']",2024-07-02,"['The Green River Ferry Status can change without advanced warning. For the most up-to-date ferry status information please call the Green River Ferry Hotline at (270) 758-2166 or follow the Mammoth Cave Roads and Ferry Twitter feed. 2 vehicle limit.', 'The Green River Ferry is open to vehicle traffic but still closed to trailers and recreational vehicles due to low water conditions. The closure will last until the river depth increases to safe levels to transport vehicles.']",MACA,"[[], []]","['Green River Ferry Status', 'The Green River Ferry Is Open to Vehicle Traffic, But..']"
,CACO,Cape Cod National Seashore,Cape Cod,NER,MA,Only using alerts,National Seashore,['Park Closure'],2024-07-02,"['Due to nesting shorebirds, the beach access at the end of Snail Road in Provincetown is temporarily closed to the public. Visitors may still walk the trail, but will need to turn around when they reach the closure.']",CACO,[[]],['Snail Road Beach Access Closed']
,GRBA,Great Basin National Park,Great Basin,PWR,NV,Only using alerts,National Park,['Park Closure'],2024-07-02,"['Visitors should expect disruptions to their experience at the park this year due to a number of major infrastructure projects involving intermittent closures to campgrounds, roads, and trailheads, For more information, click ""More"" or call 775-234-7331.']",GRBA,[[]],['Infrastructure Projects to Cause Closures and Disruptions']
,LIRI,Little River Canyon National Preserve,Little River Canyon,SER,AL,Only using alerts,National Preserve,['Park Closure'],2024-07-02,"['Due to washout and bad road conditions Slant Rock Road has been closed to all traffic aside from hikers and bikers. To access Slant Rock, park your vehicle at the hunting inspection station off of Road 103.']",LIRI,[[]],['Slant Rock Road Closed to Vehicular Traffic']
,VAFO,Valley Forge National Historical Park,Valley Forge,NER,PA,Only using alerts,National Historical Park,['Information'],2024-07-02,"['County Line Road is closed during the week, from Monday through Friday. The closure will apply to all vehicular, pedestrian, and bicycle traffic. Please find an alternate route.']",VAFO,[[]],['County Line Road Closed Monday To Friday']
,AMCH,Amache National Historic Site,Amache,IMR,CO,Only using alerts,National Historic Site,['Caution'],2024-07-02,"['Due to damage from heavy rains, some roads may require high clearance or 4x4 vehicles for passage. Please use caution when approaching and driving on roadways. Trailers over 30 ft not advised.']",AMCH,[[]],['Road Damage']
,IATR,Ice Age National Scenic Trail,Ice Age,MWR,WI,Only using alerts,National Scenic Trail,['Information'],2024-07-02,"['Trail conditions can vary throughout the state. Before heading out, check the trail conditions, potential re-routes and closures on the Ice Age Trail Alliance website.']",IATR,[[]],['Trail Conditions']
,DENA,Denali National Park and Preserve,Denali,AKR,AK,Only using alerts,National Park & Preserve,"['Park Closure', 'Information', 'Park Closure']",2024-07-02,"['Road traffic is restricted: anyone not camping in the park will be turned around. All facilities are currently closed. All frontcountry trails in the park entrance area are closed.', 'The Denali Park Road is open to Mile 15 (Savage River) for personal vehicles. Vehicle travel beyond Savage River in summer is mainly limited to transit and tour buses.', 'Summer access to facilities and services in Denali remains altered due to the Pretty Rocks Landslide and the associated closure of the Park Road at Mile 43. Check here for more information on what to expect.']",DENA,"[[], [], []]","['Riley Fire Impacts to Park Operations', 'Denali Park Road Information', 'Park Operations Altered Due to Pretty Rocks Landslide']"
,LAVO,Lassen Volcanic National Park,Lassen Volcanic,PWR,CA,Only using alerts,National Park,['Information'],2024-07-02,['Lassen National Park Highway connecting the north and south park entrances is now OPEN to through traffic. Please drive safely and obey all posted speed limits.'],LAVO,[[]],['Lassen National Park Highway is now OPEN']
,FOPO,Fort Point National Historic Site,Fort Point,PWR,CA,Only using alerts,National Historic Site,['Caution'],2024-07-02,"['You can prevent vehicle break-ins in parking lots and scenic overlooks. Before leaving your car for even a short period of time: 1) Remove all valuables, 2) Lock your doors. 3) Take your cell phones and electronics with you. Read article for more details.']",FOPO,[[]],['Auto-Theft Warning - Only Bring What You Need to the Park']
,ULSG,Ulysses S. Grant National Historic Site,Ulysses S Grant,MWR,MO,Only using alerts,National Historic Site,['Information'],2024-07-02,"[""GPS navigation systems often misdirect visitors driving to Ulysses S. Grant National Historic Site. GPS systems often route visitors to our back gate, or to the entrance for Grant's Farm (not affiliated with the NPS). Please visit our directions page.""]",ULSG,[[]],['GPS Navigation Systems']
,CRMO,Craters of the Moon National Monument and Preserve,Craters Of The Moon,PWR,ID,Only using alerts,National Monument & Preserve,['Caution'],2024-07-02,['Please do not rely upon GPS digital navigation systems to find your way to Craters of the Moon. Please note that the Visitor Center at 1266 Craters Loop Road is located just off U.S. Highway 20/26/93 and is not accessed via any unpaved roads.'],CRMO,[[]],['Navigation']
,MORR,Morristown National Historical Park,Morristown,NER,NJ,Only using alerts,National Historical Park,"['Information', 'Caution']",2024-07-02,"['On 2/29 Eastbound Morris St. will be closed down to one lane starting at Ridgedale Ave for about 140 days. Westbound Morris St will closed to all traffic starting at the intersection of Ford Ave and Taft Lane. Please plan alternate routes.', ""Tropical Storm Ida washed out the Passaic River bridge on the Patriot's Path Trail south of Tempe Wick Road. This area is a known habitat of the endangered wood turtle, so do not wade, walk, or let your dog run in the river at this location.""]",MORR,"[[], []]","['Morristown road closures beginning 29 February', 'Passaic River Trail Bridge washed out']"
,GICL,Gila Cliff Dwellings National Monument,Gila Cliff Dwellings,IMR,NM,Only using alerts,National Monument,['Information'],2024-07-02,"['Pack it in, pack it out! There are no trash services in or around the monument. All food & trash must be secured inside a vehicle or hard sided containers. Ravens routinely open zipped bags & tear into trash bags left outside or in the bed of a truck.']",GICL,[[]],['Secure trash and food']
,PISC,Piscataway Park,Piscataway,NCR,MD,Only using alerts,Park,['Information'],2024-07-02,['The Marshall Hall Access Road is closed due to construction. This road connects the Marshall Hall ruins to Marshall Hall Rd. The main road remains open.'],PISC,"[[{'title': 'Marshall Hall Access Road', 'id': '4BA1081E-8201-42D7-AB10-4950BCCB893C', 'type': 'roadevent', 'url': 'https://www.nps.gov/pisc/planyourvisit/conditions.htm'}]]",['Road Closure: Marshall Hall Access Road']
