Column Labels,Park Alpha,Park Full Name,Park Name,Reg,State,Status,Type of Unit,category,date,description,park alpha,relatedRoadEvents,title
,APPA,Appalachian,Appalachian,NER,"CT,GA,MA,MD,ME,NC,NH,NJ,NY,PA,TN,VA,VT,WV",Only using alerts,National Scenic Trail,['Park Closure'],2024-06-06,"['McAfee Knob/Route 311 parking area along the A.T. in Catawba will be closed Thursday, November 30. The lot is being closed to allow for the construction of a new pedestrian footbridge over Route 311.']",APPA,[[]],['CENTRAL VA – PARKING LOT CLOSURE– ROUTE 311/MCAFEE KNOB']
,DEWA,Delaware Water Gap National Recreation Area,Delaware Water Gap,NER,PA,Only using alerts,National Recreation Area,['Park Closure'],2024-06-06,['Old Mine Road between Millbrook Village and Worthington State Forest will be closed for the 2024 summer season for a pavement rehabilitation project. Please see news releases for more information.'],DEWA,[[]],['Old Mine Road South Closed for Rehabilitation Project']
,IATR,Ice Age National Scenic Trail,Ice Age,MWR,WI,Only using alerts,National Scenic Trail,['Information'],2024-06-06,"['Trail conditions can vary throughout the state. Before heading out, check the trail conditions, potential re-routes and closures on the Ice Age Trail Alliance website.']",IATR,[[]],['Trail Conditions']
,VAFO,Valley Forge National Historical Park,Valley Forge,NER,PA,Only using alerts,National Historical Park,['Information'],2024-06-06,"['County Line Road is closed during the week, from Monday through Friday. The closure will apply to all vehicular, pedestrian, and bicycle traffic. Please find an alternate route.']",VAFO,[[]],['County Line Road Closed Monday To Friday']
,WICR,Wilson's Creek National Battlefield,Wilson's Creek,MWR,MO,Only using alerts,National Battlefield,['Information'],2024-06-06,"[""Please be advised of potential delays or route obstructions to the Wilson's Creek National Battlefield Entrance from Hwy ZZ starting Monday, September 18th. Entering Wilson's Creek National Battlefield from Farm Road 182 via Battlefield may be faster.""]",WICR,[[]],['Occasional lane closures and traffic delays due to construction at Hwy ZZ & Farm Rd 182']
,COLM,Colorado National Monument,Colorado,IMR,CO,Only using alerts,National Monument,"['Park Closure', 'Caution']",2024-06-06,"['Closures will be from Independence Monument View to 16 1/2 Road, then 16 1/2 road to DS Road 7am to 7pm on weekdays. The road will be open on weekends. Access to Glade Park on the east and the Visitor Center on the west is not affected. Expect delays.', 'Project work runs from 4/2 - 8/5. There will be delays of up to 15 minutes and temporary road closures between DS Rd and Independence Monument View. Visit the project page for a full work schedule.']",COLM,"[[], []]","['Partial Closure of Rim Rock Drive 6/5 - 6/14', 'Resurfacing Rim Rock Drive']"
,FOWA,Fort Washington Park,Fort Washington,NCR,MD,Only using alerts,Park,['Park Closure'],2024-06-06,['The Service Road/Trail from the Lighthouse parking lot toward the lighthouse and the road between the fort and visitor center hills are closed to due scheduled construction of the roadway. Please do not enter the area.'],FOWA,[[]],['Service Road Closure']
,ROCA,Roosevelt Campobello International Park,Roosevelt Campobello,NER,ME,Only using alerts,International Park,['Information'],2024-06-06,"['Campobello Island is located in the province of New Brunswick, Canada. The physical address for the Visitor Centre is: 459 Route 774 Welshpool, New Brunswick, Canada E5E 1A4']",ROCA,[[]],['Roosevelt Campobello International Park is located in Welshpool.']
,DEPO,Devils Postpile National Monument,Devils Postpile,PWR,CA,Only using alerts,National Monument,"['Park Closure', 'Park Closure']",2024-06-06,"['Devils Postpile National Monument and Reds Meadow Road are closed for season; they will reopen on June 7, 2024.', 'Reds Meadow Road & shuttle service, which provide access to Devils Postpile, will be closed for construction from Sundays at 11 pm through Fridays at 9 am (except holidays) during the summer 2024 season. The road also closes Fridays starting September 15.']",DEPO,"[[], []]","['Devils Postpile National Monument is closed until June 7', 'Reds Meadow Road Access Restrictions in 2024']"
,YORK,Yorktown Battlefield,Yorktown,NER,VA,Only using alerts,Battlefield,['Park Closure'],2024-06-06,"['Beginning Tuesday, April 9, 2024, construction will close the Colonial Parkway to all travel in either direction between Yorktown and VA Route 199. Follow all detour signs. See additional closure information in the link below.']",YORK,[[]],['Rehabilitation of Colonial Parkway continues with additional Parkway closures']
,ROCR,Rock Creek Park,Rock Creek,NCR,DC,Only using alerts,Park,['Park Closure'],2024-06-06,"[""The bridge between the parking lot and Thompson's Boat Center in Georgetown is closed to all vehicles. The bridge's sidewalk is open to pedestrians.""]",ROCR,[[]],"[""Bridge to Thompson's Boat Center is closed""]"
,HALE,Haleakala National Park,Haleakala,PWR,HI,Only using alerts,National Park,['Information'],2024-06-06,"['Nēnē (Hawaiian geese) and ʻuaʻu (Hawaiian petrel) are nesting in the park and may land on or frequent park roads, parking lots, and road leading up to the park. Drivers are reminded to drive at the posted speed limits and exercise caution.']",HALE,[[]],['Drive Cautiously - Endangered Birds on Roadway']
,ACAD,Acadia National Park,Acadia,NER,ME,Only using alerts,National Park,"['Park Closure', 'Caution', 'Park Closure']",2024-06-06,"['Due to storm damage, vehicles must access Seawall Campground, and Wonderland and Ship Harbor trails via the west end of Route 102A (Harbor Drive) in Bass Harbor. Route 102A (Seawall Road) is closed to through traffic at the seawall until further notice.', 'Several areas throughout the carriage road system had significant washouts throughout the winter. Users, especially bicyclists, should use caution and watch for flagged areas.', 'To avoid traffic congestion, visitors should access Sand Beach via the Park Loop Road by following signs from the park’s Hulls Cove entrance on Route 3 (Eden Street) or Cadillac Mountain entrance on Route 233 (Eagle Lake Road) in Bar Harbor.']",ACAD,"[[], [], []]","['Route 102A (Seawall Road) in Southwest Harbor is closed to through traffic', 'Significant washouts on Historic Carriage Roads', 'Some Streets in Downtown Bar Harbor Closed for Construction Through Summer']"
,CACH,Canyon de Chelly National Monument,Canyon De Chelly,IMR,AZ,Only using alerts,National Monument,['Information'],2024-06-06,"['Entering the park from the east at Sawmill, AZ on Route 7 is not recommended. Part of this route is UNPAVED and UNMAINTAINED. Please stay on paved roads, such as Indian Route 64 from Tsaile, AZ and Highway 191/Route 7 from Chinle, AZ.']",CACH,[[]],"['Route 7 from Sawmill, AZ is NOT recommended']"
,ALCA,Alcatraz Island,Alcatraz Island,PWR,CA,Only using alerts,Island,['Caution'],2024-06-06,"['You can help prevent vehicle break-ins in parking lots. Before leaving your car to catch the ferry: 1) Remove all valuables, 2) Lock your doors. 3) Take your cell phones and electronics with you. Read article for more details.']",ALCA,[[]],['Auto-Theft Warning - Only Bring What You Need to the Park']
,MIMA,Minute Man National Historical Park,Minute Man,NER,MA,Only using alerts,National Historical Park,"['Park Closure', 'Park Closure']",2024-06-06,"['Battle Road Trail between Olive Stow Boardwalk to Brooks Village is closed until Summer of 2024. This will allow for the completion of a trail re-route. Entering closures is prohibited. Please plan accordingly.', 'Rolling Trail Closures and Parking Lot Closures on Battle Road Trail and at the North Bridge Trail will occur in the spring, summer and fall of 2024. Entering closures is prohibited.']",MIMA,"[[], []]","['Trail Closures on Battle Road Trail', 'Trail Closures in place to allow for trail improvements']"
,ANJO,Andrew Johnson National Historic Site,Andrew Johnson,SER,TN,Only using alerts,National Historic Site,['Caution'],2024-06-06,"['Due to the narrow roadway & tight turn, RVs, mobile homes, charter buses, delivery trucks, or vehicles with trailers are prohibited from the crest of Monument Hill. Check for information about parking at the Visitor Center upon your arrival.']",ANJO,[[]],['Notice to travelers to National Cemetery']
,GUIS,Gulf Islands National Seashore,Gulf Islands,SER,"FL,MS",Only using alerts,National Seashore,['Caution'],2024-06-06,"['Due to restriping, there may be a single lane closure on Highway 399 J Earl Bowden Highway or Johnson Beach Road.']",GUIS,[[]],['Single-lane closures']
,CAVO,Capulin Volcano National Monument,Capulin Volcano,IMR,NM,Only using alerts,National Monument,['Park Closure'],2024-06-06,"['The Volcano top road is not accessible to RVs, buses, attached trailers, or any other vehicle over 26 feet in length, due to the narrowness and weight limits of Volcano Road. Trailer drop off and RV/bus parking is available at the Visitor Center.']",CAVO,[[]],"['Volcano Road Closed to RVs and Buses over 26 feet, and to all Trailers.']"
,KAWW,Katahdin Woods and Waters National Monument,Katahdin Woods And Waters,NER,ME,Only using alerts,National Monument,['Caution'],2024-06-06,"['There is an impassable washout on the Seboeis Connector Road (46.07214,-68.63190) within the Seboeis Parcel of Katahdin Woods and Waters National Monument.']",KAWW,[[]],['Impassable Washout on Sebeois Connector Road']
,FOMC,Fort McHenry National Monument and Historic Shrine,Fort McHenry,NER,MD,Only using alerts,National Monument and Historic Shrine,['Information'],2024-06-06,"['For the safety and protection of visitors and park resources, motorized scooters are not permitted within the park. Any vehicles (scooters, bicycles, etc.) that are part of a ride-share program may not be left behind for pick up inside the park']",FOMC,[[]],['Motorized Recreational Scooters Not Permitted in Park']
,NOCA,North Cascades National Park,North Cascades,PWR,WA,Only using alerts,National Park,"['Park Closure', 'Caution']",2024-06-06,"['Cascade River Road is closed for the winter season at milepost 20 (El Dorado parking lot), three miles before the trailhead.', 'Prevent smashed windows and theft. Break-ins are not uncommon at trailheads along State Route 20. Remove your valuables and electronics and take associated electronic cords.']",NOCA,"[[], []]","['Cascade River Road Closed for the Winter Season', 'Be Aware of Break-ins along State Route 20']"
,MIMI,Minuteman Missile National Historic Site,Minuteman Missile,MWR,SD,Only using alerts,National Historic Site,['Caution'],2024-06-06,"['Vehicle Navigation Systems and GPS units may provide inaccurate information—sending drivers the wrong way on one-way roads, leading them to dead ends in remote areas, or sending them on roads which are impassable. Use the Interstate exits for wayfinding.']",MIMI,[[]],['Warning about GPS Systems!']
,NATT,Natchez Trace National Scenic Trail,Natchez Trace,SER,"AL, MS, TN",Only using alerts,National Scenic Trail,['Park Closure'],2024-06-06,"['Heavy rain has undermined a culvert making it unsafe for passage. Due to horse trailer parking availability, the entire section is closed to equestrians. Hikers are still able to travel from the railroad tracks to the Parkway Visitor Center.']",NATT,[[]],['Temporary Blackland Prairie Trail Closure to Equestrians']
,HAVO,Hawai'i Volcanoes National Park,Hawaii Volcanoes,PWR,HI,Only using alerts,National Park,['Park Closure'],2024-06-06,"['The Kaʻū Desert area is closed due to volcanic gas hazards including Hilina Pali Road, Kulanaokuaiki Campground, Pepeiao Cabin and Maunaiki Trail. Kaʻaha is open and accessible by Puna Coast Trail.']",HAVO,[[]],['Volcanic Gas Closures']
,HAFO,Hagerman Fossil Beds National Monument,Hagerman Fossil Beds,PWR,ID,Only using alerts,National Monument,['Caution'],2024-06-06,"['The new visitor center is located at 17970 US Hwy 30, about one mile north of downtown Hagerman and the old visitor center. Highway signs and GPS navigation may not yet be up-to-date.']",HAFO,[[]],['Use Caution with GPS Navigation']
,SAGU,Saguaro National Park,Saguaro,IMR,AZ,Only using alerts,National Park,['Caution'],2024-06-06,"[""Saguaro National Park is an urban park. Vehicle break-ins have occurred at trailheads around the park. Don't make yourself a target. Leave valuables at home, secure your vehicle, and report any suspicious activity.""]",SAGU,[[]],['Vehicle Break-Ins']
,TAPR,Tallgrass Prairie National Preserve,Tallgrass Prairie,MWR,KS,Only using alerts,National Preserve,['Caution'],2024-06-06,"['Highway 177 is 60 mph with a blind spot directly across from the house. Safely use the highway underpass to the Fox Creek Trail just south of the visitor center parking lot. Be smart, stay alive.']",TAPR,[[]],['Dangerous Highway Crossing']
,AMIS,Amistad National Recreation Area,Amistad,IMR,TX,Only using alerts,National Recreation Area,['Park Closure'],2024-06-06,"['Due to resource theft and damage from unauthorized off-road travel in and around the campground, the 277N Campground is closed. It is expected to reopen September 1, 2024.']",AMIS,[[]],['277N Campground Closed to Tentatively Reopen September 1']
,BIBE,Big Bend National Park,Big Bend,IMR,TX,Only using alerts,National Park,['Information'],2024-06-06,"['Bringing your pet to Big Bend National Park will limit some of your park explorations and opportunities. Pets are not allowed on park trails, in the backcountry, or on the river. Pets are allowed only where vehicles can go. Pets may not be left unattended']",BIBE,[[]],['Bringing a Pet to Big Bend?']
,SEKI,Sequoia & Kings Canyon,Sequoia & Kings Canyon,PWR,CA,Only using alerts,National Parks,"['Park Closure', 'Information']",2024-06-06,"['The section of the highway that provides access to the Cedar Grove area of Kings Canyon National Park remains closed until at least June 10 while facilities are being prepared to reopen for the first time since extreme flooding in the winter of 2022-2023.', 'Highway 245 outside the parks is under construction by CalTrans. It is scheduled to be closed through June 30, 2024. It is not possible to reach or leave the Grant Grove area using Highway 245. Alternate routes are available.']",SEKI,"[[], []]","['Highway 180 in the Cedar Grove Area of Kings Canyon National Park Closed Until At Least June 10', 'Highway 245 is Closed for Construction and Cannot Be Used to Reach or Leave the Grant Grove Area']"
,FODO,Fort Donelson National Battlefield,Fort Donelson,SER,TN,Only using alerts,National Battlefield,"['Information', 'Information']",2024-06-06,"['Beginning Sunday, March 10th, 2024, main park roads will be open to vehicular traffic from 8:00 am to 6:00 pm.', 'Fort Heiman is located at 682 Fort Heiman Road, New Concord KY. Due to poor conditions of county roads, the County has posted the loop road closed to vehicles past the park pavilion. Pedestrian access is permitted.']",FODO,"[[], []]","['Main Park Roads Open to Vehicular Traffic Starting March 10', 'County road through the Fort Heiman Unit is Closed to Vehicles Past the Pavilion']"
,LAMR,Lake Meredith National Recreation Area,Lake Meredith,IMR,TX,Only using alerts,National Recreation Area,['Caution'],2024-06-06,"['Roadwork at the Sanford-Yake area will begin on Monday, May 6, 2024. Expect delays.']",LAMR,[[]],['Road Construction at Sanford-Yake']
,MACA,Mammoth Cave National Park,Mammoth Cave,SER,KY,Only using alerts,National Park,['Information'],2024-06-06,['The Green River Ferry Status can change without advanced warning. For the most up-to-date ferry status information please call the Green River Ferry Hotline at (270) 758-2166 or follow the Mammoth Cave Roads and Ferry Twitter feed. 2 vehicle limit.'],MACA,[[]],['Green River Ferry Status']
,CRLA,Crater Lake National Park,Crater Lake,PWR,OR,Using TDx feed and alerts,National Park,['Park Closure'],2024-05-22,"['The roads will not reopen until sometime in June or July as plow operators are gradually able to clear sections of large quantities of snow. All other roads remain OPEN, *weather permitting.* Expect snowy and icy conditions. All Oregon chain laws apply.']",CRLA,"[[{'title': 'Seasonal Road Closure', 'id': '05BCCDA8-57AE-4A45-8C5B-D045D6810624', 'type': 'roadevent', 'url': 'https://www.nps.gov/crla/planyourvisit/conditions.htm'}]]",['Rim Drive and North Entrance Road are CLOSED for the Season']
,SLBE,Sleeping Bear Dunes National Lakeshore,Sleeping Bear Dunes,MWR,MI,Using TDx feed and alerts,National Lakeshore,['Information'],2024-05-22,"['A rolling closure of Lakeshore parking lots and roads will occur the week of April 15, 2024. Cracks and holes in the asphalt will be sealed ahead of a larger paving project beginning in May.']",SLBE,[[]],['Asphalt sealing']
,BUFF,Buffalo National River,Buffalo,MWR,AR,Using TDx feed and alerts,National River,"['Park Closure', 'Information', 'Information']",2024-05-22,"['In the interest of safety, the South Woolum Road has been closed. The Woolum launch and campground remain open.', 'Parking will no longer be permitted on the road to allow space for emergency vehicles to safely enter the park. There will be ‘No Parking’ signs placed along the Kyles Landing Road, also known as County Road 56.', 'The Spring Creek Landing has been closed to vehicle-assisted launches. Watercraft may still be put in and take out at this point, but must be hand carried to and from the parking area. This is to ensure the safety of visitors and avoid continued erosion.']",BUFF,"[[{'title': 'South Woolum Road Closure', 'id': '83A17F44-C295-4B5D-82F4-C770BDB1CD1A', 'type': 'roadevent', 'url': 'https://www.nps.gov/buff/planyourvisit/conditions.htm'}], [], []]","['South Woolum Road Closed, Alternate Route Available', 'Parking is not permitted on the Kyles Landing Road (County Road 56)', 'Spring Creek Landing Closed to Vehicle-Assisted Launches']"
,YOSE,Yosemite National Park,Yosemite,PWR,CA,Using TDx feed and alerts,National Park,['Park Closure'],2024-05-22,['Tioga Road (continuation of Highway 120 through the park) is closed for the season due to snow. It usually opens in late May or June. Mariposa Grove Road and shuttle service are also closed for the winter.'],YOSE,"[[{'title': 'Winter Closure', 'id': 'F407F7C6-5FC6-4DA3-A1C1-7B2B32DF5052', 'type': 'roadevent', 'url': 'https://www.nps.gov/yose/planyourvisit/conditions.htm'}]]",['Tioga Road and Mariposa Grove Road (and shuttle service) are closed for the winter']
,GRSM,Great Smoky Mountains National Park,Great Smoky Mountains,SER,"TN,NC",Using TDx feed and alerts,National Park,"['Park Closure', 'Information', 'Park Closure']",2024-05-22,"['Cades Cove Loop Road is motor vehicle-free all day on Wednesdays from May through September to provide opportunities for cyclists and pedestrians to experience Cades Cove without motor vehicles.', 'All vehicles parking for longer than 15 minutes require a parking tag. Three tag durations are available for purchase for all vehicle sizes and types: Daily ($5), Weekly ($15), or Annual ($40).', 'Several trails in the park are temporarily closed. Please check the ""Trail and Backcountry Closures, Warnings & Cautions"" section of the Current Road, Facility, Trail & Backcountry Updates page for further details.']",GRSM,"[[], [], []]","['Cades Cove closed Wednesdays to motor vehicles', 'Most visitors need a parking tag', 'Trail Advisory']"
,CURE,Curecanti National Recreation Area,Curecanti,IMR,CO,Using TDx feed and alerts,National Recreation Area,"['Information', 'Park Closure']",2024-05-22,"['One lane will be closed for roadwork with alternating traffic Mondays through Fridays from 8am to 6:30pm. No weekend work is planned. Westbound traffic will experience longer delays between noon and 1pm, so plan accordingly. Wait times will vary.', 'Colorado Department of Transportation has closed US 50 between County Road 26 and Red Creek Road (18 to 20 miles west of Gunnison) from Mile Point 136 to Mile Point 138. Plan to use alternate routes. No anticipated reopening date.']",CURE,"[[{'title': 'Little Blue Creek Canyon Construction', 'id': '3949A0BC-9FC3-483A-892A-52B73482783A', 'type': 'roadevent', 'url': 'https://www.nps.gov/cure/planyourvisit/conditions.htm'}], [{'title': 'US-50 Emergency Closure', 'id': '3CE2C6E6-AA94-4CC1-A155-B9E343D0F71B', 'type': 'roadevent', 'url': 'https://www.nps.gov/cure/planyourvisit/conditions.htm'}]]","['US 50 Roadwork - Little Blue Creek Canyon', 'US 50 Emergency Closure']"
,BLCA,Black Canyon of the Gunnison National Park,Black Canyon Of The Gunnison,IMR,CO,Using TDx feed and alerts,National Park,"['Information', 'Park Closure', 'Park Closure', 'Caution']",2024-05-22,"['Road construction starts May 13, 2024, with alternating one-way closures Mon-Fri 8:00am-6:30pm. The project is located on US Highway 50 between mileposts 123 and 127, approx. 30 miles east of Montrose, CO. Refer to www.us50info.com for updated information', 'Phase one of this major road improvement project is underway with alternating one-way traffic (expect 15-minute delays, multiple stops) starting at the park entrance on Hwy 347. Tomichi Point parking lot and viewpoint are closed until at least mid-May.', 'CO Dept. of Transportation has closed US Highway 50 in both directions between County Road 26 and Red Creek Road (42 to 44 miles east of Montrose), from mile marker 136 to 138, for bridge work. Check https://www.codot.gov/news/media/overview for updates.', 'Major road improvement projects will impact the park from April-November 2024. Expect delays, alternating one-way traffic, and parking lot closures from the park boundary on Hwy 347 to the visitor center. Drive with extra caution. More road work in 2025.']",BLCA,"[[], [], [], [{'title': 'South Rim Road Construction', 'id': '75883C21-B99F-44AB-A551-DDBAD3306156', 'type': 'roadevent', 'url': 'https://www.nps.gov/blca/planyourvisit/conditions.htm'}]]","['Highway 50 - Little Blue Creek Canyon Construction', 'Road Construction Update - Delays and Closures in Effect', 'U.S. Highway 50 Closure - East of Black Canyon', 'Road Construction at Black Canyon South Rim - 2024 and 2025']"
,MOJA,Mojave National Preserve,Mojave,PWR,CA,Using TDx feed and alerts,National Preserve,"['Danger', 'Park Closure', 'Information']",2024-05-22,"['Hart Mine Road is missing several wooden culverts the burned in the 2023 York Fire. The road may appear intact but could cave in under the weight of a vehicle. Stay off of Hart Mine Road for your safety.', 'Cima Road between Kelso Cima Road in Cima and Interstate 15 along the north preserve boundary is CLOSED to all vehicles. Please do not drive around barricades, or cross this active construction zone in the Cima Dome area.', 'Mojave National Preserve Road Crews will be repairing a problematic low water crossing ~2 miles north of the Junction of Cedar Canyon Road. Minor Delays are expected.']",MOJA,"[[{'title': 'Hart Mine Road', 'id': '09EAF34E-7380-4129-A04E-4F3AF013E1BD', 'type': 'roadevent', 'url': 'https://www.nps.gov/moja/planyourvisit/conditions.htm'}], [{'title': 'Cima Road Closed to ALL VEHICLES due to Construction', 'id': '734DA552-488D-4A3F-979D-751E95AB05CA', 'type': 'roadevent', 'url': 'https://www.nps.gov/moja/planyourvisit/conditions.htm'}], [{'title': 'Ivanpah Low Water Crossing Repair', 'id': 'DEC80F3F-5E36-4E09-9DA3-1B74F93163D1', 'type': 'roadevent', 'url': 'https://www.nps.gov/moja/planyourvisit/conditions.htm'}]]","['Hart Mine Road Closed due to dangerous potential for collapse', 'Cima Road between Cima and Interstate 15 CLOSED Until Late June 2024', 'Ivanpah Road Repairs - Traffic Subject to minor delays']"
,GUMO,Guadalupe Mountains National Park,Guadalupe Mountains,IMR,TX,Using TDx feed and alerts,National Park,"['Information', 'Caution']",2024-05-22,"['The Williams Ranch Road is currently impassable and closed to public access due to unsafe conditions.', ""The hike to Devil's Hall is rated as strenuous. The portion of the route in the wash requires rock scrambling and is dangerous when wet or if water is present. The wash surface is loose gravel and rocks and may be unstable.""]",GUMO,"[[{'title': 'Williams Ranch Road Closure', 'id': 'E22F9CF8-0208-4993-A8B3-C3E25406C972', 'type': 'roadevent', 'url': 'https://www.nps.gov/gumo/planyourvisit/conditions.htm'}], []]","['Williams Ranch Road Closed', ""Devil's Hall is a Strenuous Hike""]"
,OZAR,Ozark National Scenic Riverways,Ozark,MWR,MO,Using TDx feed and alerts,National Scenic Riverways,['Caution'],2024-05-22,['The Akers Ferry on State Highway K will not be in service until further notice.'],OZAR,"[[{'title': 'Akers Ferry Closure', 'id': 'B6DEFC30-C21C-4E29-A626-5FFCEA446EA8', 'type': 'roadevent', 'url': 'https://www.nps.gov/ozar/planyourvisit/conditions.htm'}]]",['River Ferry at Akers (on State Highway K) CLOSED until further notice']
