id,url,title,park alpha,description,category,relatedRoadEvents,LastIndexedDate,park,region,alpha,State,Road Closed Flag,date
77ECB59E-1CA6-4369-AA48-A04DF771C596,https://www.nps.gov/shen/meadow-run-watershed-restoration.htm,Skyline Drive Status,SHEN,"Skyline Drive is closed from Loft Mountain (79.5) to Rockfish Gap (mile 105) for aerial limestone treatment. Click ""more"" for details and other temporary area closures.",Park Closure,[],2026-02-17 00:00:00.0,Shenandoah National Park,NER,SHEN,VA,yes,2026-02-17
71B56BC1-B916-4301-9A1D-96663ABD0A43,https://www.nps.gov/meve/planyourvisit/weather.htm,Delayed Opening Due to Snow and Ice,MEVE,"Tuesday, February 17, 2026 The park and roads will open at 11 am. The Visitor and Research Center opens at noon. If a park-wide closure is required, notification will appear around 10 am. Colorado traction laws will be in effect. Drive cautiously, plows will still be working.",Park Closure,[],2026-02-17 00:00:00.0,Mesa Verde National Park,IMR,MEVE,CO,yes,2026-02-17
95C687BB-074D-4A53-B12E-CA1739FA6FC7,https://www.nps.gov/mora/planyourvisit/winter-travel.htm,"Paradise Road Status: Gate closed at Longmire, projected to open tomorrow",MORA,"02/17/2026 The road is open to Longmire. All vehicles, including 4WD and AWD, must carry tire chains and be ready to use them. The gate at Longmire to Paradise is closed to support public safety and is projected to open, conditions permitting, tomorrow, Wednesday 02/18/2026",Park Closure,"[{'title': 'Nightly Paradise Road Closure', 'id': '95C687BB-074D-4A53-B12E-CA1739FA6FC7', 'type': 'roadevent', 'url': 'https://www.nps.gov/mora/planyourvisit/conditions.htm'}]",2026-02-17 00:00:00.0,Mount Rainier National Park,PWR,MORA,WA,yes,2026-02-17
76A6A599-A4B8-49C3-BD32-56620117ECE2,,Newton B. Drury Scenic Parkway Closure,REDW,"Due to the incoming storm system, the Parkway is closed until later this week. Access to the Prairie Creek Visitor Center and Elk Prairie Campground will not be affected. Use Exit 753 to reach Prairie Creek Visitor Center.",Park Closure,"[{'title': 'Newton B. Drury Scenic Parkway Closure', 'id': '76A6A599-A4B8-49C3-BD32-56620117ECE2', 'type': 'roadevent', 'url': 'https://www.nps.gov/redw/planyourvisit/conditions.htm'}]",2026-02-16 00:00:00.0,Redwood National Park,PWR,REDW,CA,yes,2026-02-17
A04AED55-0E2F-474B-96DD-C76EBDC1BEBD,https://forecast.weather.gov/MapClick.php?lon=-122.13198849186297&lat=42.89862877968113,Road to Rim Village will CLOSE at 4:30 PM Today,CRLA,"The road from Park Headquarters to Rim Village will CLOSE at 4:30 PM today due to the incoming snowstorm. Once that happens, no view of the lake is accessible by vehicle at this time. Please use caution if driving in the park. All Oregon Chain Laws apply.",Park Closure,"[{'title': 'Road from HQ to Rim Village Remains CLOSED.', 'id': 'A04AED55-0E2F-474B-96DD-C76EBDC1BEBD', 'type': 'roadevent', 'url': 'https://www.nps.gov/crla/planyourvisit/conditions.htm'}]",2026-02-16 00:00:00.0,Crater Lake National Park,PWR,CRLA,OR,yes,2026-02-17
2D6862D7-9E2F-42EB-87CB-922FEB8A77E7,,"Hurricane Ridge Road Status, Tuesday 2/17 - Thursday 2/19",OLYM,"During the winter season the Hurricane Ridge Road remains closed during weekdays. The road is expected to reopen on Friday 2/20 at 9am, although significant snow could delay this opening.",Park Closure,[],2026-02-16 00:00:00.0,Olympic National Park,PWR,OLYM,WA,yes,2026-02-17
E5355262-0BAB-4F46-B7C0-220B97385438,https://www.nps.gov/yose/planyourvisit/wroads.htm,Tioga Road (Hwy 120 through the park) and Glacier Point Road are closed,YOSE,"Tioga Road (continuation of Highway 120 through the park), Glacier Point Road beyond Badger Pass, and Mariposa Grove Road are closed for the season due to snow. Snow is possible on other roads; be prepared for tire chain requirements and other road closures. Call 209/372-0200 (then 1, 1) to check road conditions.",Park Closure,"[{'title': 'Tioga and Glacier Point Roads winter closure', 'id': 'E5355262-0BAB-4F46-B7C0-220B97385438', 'type': 'roadevent', 'url': 'https://www.nps.gov/yose/planyourvisit/conditions.htm'}]",2026-02-16 00:00:00.0,Yosemite National Park,PWR,YOSE,CA,yes,2026-02-17
C99E98BD-745E-4B7C-BB54-D70F70C808EA,,Big Oak Flat Road is temporarily closed due to snow,YOSE,"Big Oak Flat Road (continuation of Hwy 120 toward Yosemite Valley from the west) is temporarily closed from Big Oak Flat Entrance to Foresta junction due to snow. Highway 140/El Portal Road is the alternate route. Call 209/372-0200 (then 1, 1) for updates.",Park Closure,"[{'title': 'Big Oak Flat Road temporary snow closure', 'id': 'C99E98BD-745E-4B7C-BB54-D70F70C808EA', 'type': 'roadevent', 'url': 'https://www.nps.gov/yose/planyourvisit/conditions.htm'}]",2026-02-16 00:00:00.0,Yosemite National Park,PWR,YOSE,CA,yes,2026-02-17
D41873A5-E2D2-4F37-8F26-3B4B2DB0CF4F,,All But 6 Miles of Generals Highway Temporarily Closed Due to Winter Storm,SEKI,"Due to heavy snow from an ongoing winter storm, Generals Highway is temporarily closed north of Hospital Rock. This means only the southern six miles near the town of Three Rivers is open. The U.S. Forest Service Quail Flat Winter Trailhead and Wolverton Snowplay Area are not accessible during the closure. Sections of the highway will reopen when road crews are able to clear the roadway.",Park Closure,"[{'title': 'Temporary Closure of Much of Generals Highway Due to Winter Storm Impacts', 'id': 'D41873A5-E2D2-4F37-8F26-3B4B2DB0CF4F', 'type': 'roadevent', 'url': 'https://www.nps.gov/seki/planyourvisit/conditions.htm'}]",2026-02-16 00:00:00.0,Sequoia & Kings Canyon,PWR,SEKI,CA,yes,2026-02-17
5F5FCEFD-5537-499B-B7DB-C97CCD18319B,,Temporary Meyers Beach Parking Lot and Access Road Closure,APIS,Meyers Beach parking lot and Meyers Beach access road are temporarily closed to protect visitor safety and support incident management.,Park Closure,[],2026-02-14 00:00:00.0,Apostle Islands National Lakeshore,MWR,APIS,WI,yes,2026-02-17
84A3E324-2998-450B-9E39-ED01C1730755,,Winter storm forecast: carry tire chains and be prepared for road closures,YOSE,"Tire chain requirements and some road closures are likely starting Monday, February 16, due to a forecast of heavy snow. Call 209/372-0200 (then 1, 1) for current road status within Yosemite National Park.",Park Closure,[],2026-02-14 00:00:00.0,Yosemite National Park,PWR,YOSE,CA,yes,2026-02-17
8307538D-35BF-47C3-84BF-6A59C34F41F6,,Cades Cove Loop Road closures February 23-27,GRSM,Cades Cove Loop Road will be closed to all users February 23-27 for hazard tree removal. The road will reopen at 12 PM on Friday and remain open through the weekend during regular hours (sunrise to sunset).,Caution,"[{'title': 'Cades Cove Loop Road', 'id': '8307538D-35BF-47C3-84BF-6A59C34F41F6', 'type': 'roadevent', 'url': 'https://www.nps.gov/grsm/planyourvisit/conditions.htm'}]",2026-02-13 00:00:00.0,Great Smoky Mountains National Park,SER,GRSM,"TN,NC",yes,2026-02-17
124BBED9-F3C6-474A-A262-48C0B1249FFA,https://www.nps.gov/gwmp/learn/news/multiple-park-areas-and-facilities-managed-by-the-george-washington-memorial-parkway-will-remain-closed-due-to-winter-weather-impacts.htm,Clara Barton NHS to Remain Closed Through February 17 2026,CLBA,"George Washington Memorial Parkway, including Clara Barton NHS, and other park areas and facilities will remain closed through February 17 due to winter weather impacts. Click on ""More"" below for details on specific closures. Areas will reopen as soon as conditions are safe. For the latest updates, visitors should check www.nps.gov/gwmp and GWMP social media. Next update expected: February 17",Park Closure,[],2026-02-13 00:00:00.0,Clara Barton National Historic Site,NCR,CLBA,MD,yes,2026-02-17
6488CF7F-1A82-4362-A2E7-1D282DD585FB,,Inclement Weather Closure,BLRI,Closure due to hazardous road conditions due to weather conditions. Recreation is authorized in sections closed for winter weather only.,Park Closure,"[{'title': 'Inclement Weather Closure', 'id': '6488CF7F-1A82-4362-A2E7-1D282DD585FB', 'type': 'roadevent', 'url': 'https://www.nps.gov/blri/planyourvisit/conditions.htm'}]",2026-02-12 00:00:00.0,Blue Ridge Parkway,SER,BLRI,"NC,VA",yes,2026-02-17
8460B2B2-9B79-48DB-96A0-42411356CAE0,,Road to the Trailhead Parking Lot is Closed to Vehicles for the Season,BIHO,The road leading to the trailhead parking lot at the Big Hole National Battlefield is closed to vehicles for the season but remains open for use by snowshoers & cross-country skiers. The road to the visitor center remains open to vehicles year-round.,Information,[],2026-02-10 00:00:00.0,Big Hole National Battlefield,PWR,BIHO,MT,yes,2026-02-17
82DB9E9B-238C-4841-9001-74906E6B8C29,https://www.nps.gov/natr/learn/news/2025_detour_update.htm,12/12/2025 Update - Parkway and Campground closed from MP 181-204.,NATR,"The parkway is closed to all traffic from MP 181-204. The section of the parkway, including the Jeff Busby Campground and day use area, has been closed since June 9, 2025, to allow for the removal and replacement of failed pavement and culverts. While the project was initially expected to be completed by the end of summer, unforeseen site conditions and weather delays have extended the timeline. A definitive reopening date is not available at this time. Construction will continue into 2026.",Park Closure,"[{'title': 'Road Repavement', 'id': '82DB9E9B-238C-4841-9001-74906E6B8C29', 'type': 'roadevent', 'url': 'https://www.nps.gov/natr/planyourvisit/conditions.htm'}]",2026-02-10 00:00:00.0,Natchez Trace Parkway,SER,NATR,"AL,MS,TN",yes,2026-02-17
B48484DA-9911-45FD-83CD-4CE3E4E05CD8,https://www.udottraffic.utah.gov,State Route 148 Closed Through Cedar Breaks National Monument,CEBR,State Route 148 through Cedar Breaks National Monument is now closed for its routine winter season. Plan alternate routes and check back for updates. Visit the Utah Department of Transportation website for more route information: www.udottraffic.utah.gov,Danger,[],2026-02-10 00:00:00.0,Cedar Breaks National Monument,IMR,CEBR,UT,yes,2026-02-17
2F6EEBC3-415C-4D60-B8FA-2709A0D6540D,,Invasive Vegetation Removal,EVER,"Watch for crews treating invasive plants along Snake Bight Trail, Rowdy Bend Road, and other Flamingo areas. Approved herbicides are being used. Stay alert for workers, equipment, and posted signs.",Information,[],2026-02-09 00:00:00.0,Everglades National Park,SER,EVER,FL,yes,2026-02-17
ADF8E543-475D-4727-A908-245A8E5CC495,,Roadwork Along Lakeshore Drive at the Alfred Smith Water Treatment Plant,LAKE,"Starting February 9th, 2026, roadwork will begin on the east shoulder of Lakeshore Drive between the water treatment plant and the Lake Mead Fish Hatchery for the installation of a pipeline. Flaggers will be present during the project, but only minimal traffic delays are anticipated at times that traffic is restricted to one lane. The project is expected to be completed in a few months.",Caution,[],2026-02-09 00:00:00.0,Lake Mead National Recreation Area,PWR,LAKE,NV,yes,2026-02-17
44268CD3-2F86-4B47-A544-64309C0CC708,,Playalinda District will reopen to the public on Friday February 6,CANA,Playalinda District operating hours - 8:00 a.m.- 5:00 p.m.  (Apollo is still 6:00 a.m.-6:00 p.m.) All inbound and outbound vistas will remain closed for security purposes. Parking areas 1-3 will remain closed for security purposes. The beach at parking area 4 and south to the NPS/KSC boundary will remain closed to the public.,Park Closure,[],2026-02-08 00:00:00.0,Canaveral National Seashore,SER,CANA,FL,yes,2026-02-17
2F5F7EBC-3B67-46CB-9492-B3AEFB1D9D73,,Hains Point Closed Until Further Notice,NAMA,Ohio Drive is closed until further notice from East Potomac Golf Links to Hains Point and back due to snow. We apologize for any inconvenience.,Park Closure,[],2026-02-06 00:00:00.0,National Mall,NCR,NAMA,DC,yes,2026-02-17
4D18B12B-E625-4D7C-825A-C779A6EACCA5,https://jeffersoncountypublichealth.org/CivicAlerts.aspx?AID=1478&ARC=3292,South Shore Quinault Road Washed Out Beyond Park Boundary,OLYM,"South Shore Road – which is maintained by Jefferson County – is closed due to a major wash-out. For more information, visit the Jefferson County website.",Information,[],2026-02-06 00:00:00.0,Olympic National Park,PWR,OLYM,WA,yes,2026-02-17
DCAA0DED-C016-4077-A9A7-A3AF81BF7759,,Access to Bluestone NSR through Bluestone State Park is closed,BLUE,"Due to road damage, the road to access Bluestone National Scenic River through Bluestone State Park is closed. The road will remain completely closed as repairs are made. It is expected to reopen in late April or early May.",Information,[],2026-02-06 00:00:00.0,Bluestone National Scenic River,NER,BLUE,WV,yes,2026-02-17
D143C837-28F0-4759-B604-8DB084276532,https://www.nps.gov/elma/planyourvisit/driving-to-big-tubes.htm,NPS 300 Road Conditions,ELMA,"NPS 300 to Big Tubes contains deep, muddy ruts. A high clearance, four-wheel-drive vehicle is required to attempt this road. Conditions will deteriorate as snow melts.",Caution,[],2026-02-06 00:00:00.0,El Malpais National Monument,IMR,ELMA,NM,yes,2026-02-17
F9668D02-A2D8-4D5D-8B02-EA29BBE3268F,https://www.fairfaxcounty.gov/parks/park-news/2026/scotts-run-temporary-closure-urgent-sewer-repairs,"Trail Closure at Scott’s Run Nature Preserve (McLean, Virginia)",POHE,"Scott’s Run Nature Preserve in McLean, Virginia will close, beginning February 16th, for an urgent sewer project to renew and rehabilitate the Scott's Run Siphon wastewater facility. All trails and parking lots in the park are closed for approximately three months.",Park Closure,[],2026-02-05 00:00:00.0,Potomac Heritage,NCR,POHE,"DC,MD,PA,VA",yes,2026-02-17
AFB62133-8726-41CB-93A5-848C94B0AE2B,,Vehicle Weight Limit at Kenilworth Aquatic Gardens Entrance,KEAQ,"Due to structural conditions at the driveway entrance, access to the Kenilworth Aquatic Gardens main entrance and parking lot is limited to vehicles with a gross vehicle weight rating (GVWR) of 16,000 pounds or less.",Danger,[],2026-02-05 00:00:00.0,,,,,yes,2026-02-17
D7C1A68E-7C91-4992-8341-537964C70079,,Replace Bocce Ball Court Retaining Wall,SAFR,"Project work begins on Monday, February 9 to replace the bocce ball 50-foot retaining wall in order to improve existing infrastructure and enhance visitor safety. Several parking spots on lower Van Ness will be fenced off and the bocce ball court will not be accessible for the duration of the project, slated through August 2026. Please be aware of machinery, work, and signs.",Information,[],2026-02-05 00:00:00.0,San Francisco Maritime National Historical Park,PWR,SAFR,CA,yes,2026-02-17
2397FFE0-9476-48E8-AFCB-88B3EF38F48C,,West and East Border Roads closed for public safety,ORPI,South Puerto Blanco Drive remains open. All border roads remain closed (the dirt roads directly along the border and all crossover roads leading from South Puerto Blanco Drive to the border) to all public vehicle and pedestrian traffic for public safety.,Park Closure,[],2026-02-04 00:00:00.0,Organ Pipe Cactus National Monument,IMR,ORPI,AZ,yes,2026-02-17
A0324FAD-FF80-47B5-B9FD-34B9D9C66B25,https://www.nps.gov/rocr/learn/management/record-of-determination-for-a-partial-and-temporary-closure-of-a-portion-of-certain-federal-parkland-at-the-carter-barron-parking-lot-for-human-health-and-safety.htm,Temporary closure of portions of the Carter Barron parking lot,ROCR,The south and southwest sections of the parking lot at the Carter Barron Amphitheater (US Reservation 339) are temporarily closed to allow the safe operation of District of Columbia snow storage activities as a result of Winter Storm Fern. See the Record of Determination for more information.,Information,[],2026-02-03 00:00:00.0,Rock Creek Park,NCR,ROCR,DC,yes,2026-02-17
8EC53217-5E7C-41BD-A60A-B276B221423C,https://www.nps.gov/pore/learn/management/lawsandpolicies.htm#temporaryclosures,Drakes Beach Road open 10 am to 5 pm to better protect elephant seal pups.,PORE,"Alert 1, Severity closure, Drakes Beach Road now only open 10 am to 5 pm to better protect elephant seal pups. Northern elephant seals have returned to Drakes Beach and given birth close to beach access points. To better protect the pups during this important time, the parking lot will only be open when park staff and volunteers are present, every day from 10:00 am to 5:00 pm. The beach itself will remain closed, but seals are viewable from the parking lot and Ken Patrick Visitor Center area during these ho",Park Closure,[],2026-02-02 00:00:00.0,Point Reyes National Seashore,PWR,PORE,CA,yes,2026-02-17
4B90ADC8-4E9F-4E63-84E8-1D3AA9A30751,,Pavement Project- Playalinda District,CANA,"The Playalinda Beach District continues a Federal Highways pavement preservation project that started on Sept. 22nd, 2025. Visitors to the seashore could expect limited access to some parking areas and roadways to include the vistas.",Caution,[],2026-01-26 00:00:00.0,Canaveral National Seashore,SER,CANA,FL,yes,2026-02-17
A938A005-678D-4F0D-B343-62CDF69CE084,,Winter Closures,BLCA,"The following areas are closed for the winter season: [1] South Rim Road beyond the visitor center. [2] All North Rim facilities and vehicle access. North Rim Road is closed to vehicles and gated at the park boundary. [3] East Portal Road--the road and its closure are managed by the U.S. Bureau of Reclamation. Pedestrians and bicycles are currently allowed on closed roads, conditions permitting. Use caution.",Park Closure,"[{'title': 'Winter Closures', 'id': 'A938A005-678D-4F0D-B343-62CDF69CE084', 'type': 'roadevent', 'url': 'https://www.nps.gov/blca/planyourvisit/conditions.htm'}]",2026-01-26 00:00:00.0,Black Canyon of the Gunnison National Park,IMR,BLCA,CO,yes,2026-02-17
79C3F009-8E76-494D-A844-45F76085B238,,East Portal Road Closed,CURE,The East Portal Road is closed for the winter season.,Information,"[{'title': 'East Portal Road Closed', 'id': '79C3F009-8E76-494D-A844-45F76085B238', 'type': 'roadevent', 'url': 'https://www.nps.gov/cure/planyourvisit/conditions.htm'}]",2026-01-26 00:00:00.0,Curecanti National Recreation Area,IMR,CURE,CO,yes,2026-02-17
9CF4FF73-1898-4A31-A47B-BB6D37E74D67,https://www.nps.gov/hocu/contacts.htm,Hopeton Earthworks Closed for Construction Until May 2026,HOCU,"Hopeton Earthworks, located at 990 Hopetown Rd. Chillicothe, OH 45601, is closed for construction until May 2026. Parking lot improvements and construction activity will block safe access to cars and foot traffic at the trail heads. Call the park at 740-774-1126 for more information or visit the park's Mound City Group Visitor Center at 16062 State Route 104, Chillicothe, OH 45601.",Caution,[],2026-01-25 00:00:00.0,Hopewell Culture National Historical Park,MWR,HOCU,OH,yes,2026-02-17
92CE4554-B891-4CBF-84DB-202602F378AE,https://wsdot.com/travel/real-time/map/,State Route 20 Closed MP112,NOCA,State Route 20 is closed at milepost 112 limiting access into the park. Additional closures may exist along SR20. For more information click the link to the WSDOT real time map.,Park Closure,[],2026-01-21 00:00:00.0,North Cascades National Park,PWR,NOCA,WA,yes,2026-02-17
D5E83F53-BDF4-42DB-81F5-536A7FA33E5C,https://home.nps.gov/vall/planyourvisit/bc.htm,Backcountry vehicle route closed for winter season,VALL,"Vehicular access to Valles Caldera's backcountry is currently closed for the 2025-2026 winter season. During the off-season, the route will remain open to pedestrians, equestrians, cyclists, skiers, and snowshoers. The route is scheduled to reopen to vehicular traffic on May 15, 2026.",Information,[],2026-01-21 00:00:00.0,Valles Caldera National Preserve,IMR,VALL,NM,yes,2026-02-17
B5A0DE37-11E9-493A-9D17-595D097AC490,,Intermittent Closure of Park Loop Trailhead parking,NERI,From January 15 through March 5 there may be intermittent closures of the Park Loop Trail parking lot at Fayetteville Town Park as crews are working on a project to expand parking in that location.,Information,[],2026-01-20 00:00:00.0,New River Gorge National Park and Preserve,NER,NERI,WV,yes,2026-02-17
C6B6FF0D-39EC-46F0-8A6D-582D9F3A38C5,,Smith Point Bridge Following Single Lane Traffic Pattern,FIIS,Visitors driving to access the Otis Pike Wilderness and Smith Point County Park should be aware that the Smith Point Bridge is open currently following a single lane traffic pattern. There is a 15 ton vehicle weight limit.,Information,[],2026-01-16 00:00:00.0,Fire Island National Seashore,NER,FIIS,NY,yes,2026-02-17
FF6F4C51-FA9E-4FE3-A419-63EC684CDEC8,https://www.nps.gov/grsm/planyourvisit/seasonalroads.htm,Seasonal road closures,GRSM,"The following roads are closed for the season: Kuwohi Road, Roaring Fork Motor Nature Trail, Little Greenbrier Road, Heintooga Ridge Road, Forge Creek Road, Parson Branch Road, and Rich Mountain Road.",Park Closure,"[{'title': 'Seasonal road closures', 'id': 'FF6F4C51-FA9E-4FE3-A419-63EC684CDEC8', 'type': 'roadevent', 'url': 'https://www.nps.gov/grsm/planyourvisit/conditions.htm'}]",2026-01-16 00:00:00.0,Great Smoky Mountains National Park,SER,GRSM,"TN,NC",yes,2026-02-17
D9A9DD10-3B81-4982-A6B4-584A050C5E37,https://www.nps.gov/blri/planyourvisit/road-construction-projects.htm,Ongoing Road Projects and Helene Recovery,BLRI,"Parkway areas closed for ongoing road maintenance, construction, and Helene recovery projects.",Park Closure,"[{'title': 'Ongoing Road Projects and Helene Recovery', 'id': 'D9A9DD10-3B81-4982-A6B4-584A050C5E37', 'type': 'roadevent', 'url': 'https://www.nps.gov/blri/planyourvisit/conditions.htm'}]",2026-01-16 00:00:00.0,Blue Ridge Parkway,SER,BLRI,"NC,VA",yes,2026-02-17
442CB6D9-2EAB-4500-BB3D-29F02215F9B1,https://www.nps.gov/grba/planyourvisit/conditions.htm,Winter Road Closures,GRBA,"The Wheeler Peak Scenic Drive is closed for the season at Upper Lehman Creek Campground (mile 3). Snake Creek Road and Strawberry Creek Road are closed for the season at the park boundary. Baker Creek Road is closed at Grey Cliffs Campground. Click ""more"" for current road and campground closures.",Park Closure,"[{'title': 'Winter Road Closures', 'id': '442CB6D9-2EAB-4500-BB3D-29F02215F9B1', 'type': 'roadevent', 'url': 'https://www.nps.gov/grba/planyourvisit/conditions.htm'}]",2026-01-15 00:00:00.0,Great Basin National Park,PWR,GRBA,NV,yes,2026-02-17
EE18B263-0E7C-43BD-985C-4B6D9B7E870B,https://www.nps.gov/deva/planyourvisit/conditions.htm,Some roads and campgrounds closed,DEVA,"Several park roads and campgrounds are closed due to flash flooding on 12/24, 1/1 & 1/3. Some open roads have damaged shoulders and debris. Drive with caution. Click ""more"" and scroll down for detailed information.",Information,[],2026-01-15 00:00:00.0,Death Valley National Park,PWR,DEVA,"CA, NV",yes,2026-02-17
90F89B9B-CA3A-4D7F-A62A-F1BE78E5FC15,,Tyler Bend Area Closures,BUFF,"Starting on January 20, 2026, the Tyler Bend Pavilion, Pavilion Parking Area, and Lower Launch river access will be closed to the public due to a construction project. The area is expected to open no later than March 31, 2026.",Park Closure,[],2026-01-15 00:00:00.0,Buffalo National River,MWR,BUFF,AR,yes,2026-02-17
79218B4E-3346-4065-8A50-75F73310FBB0,https://www.nps.gov/kemo/learn/news/kennesaw-mountain-nbp-to-close-mountain-road-to-private-vehicles-beginning-january-2026.htm,Kennesaw Mountain Road Closed to Private Vehicles and Cyclists,KEMO,"Starting January 5th, 2026, the road to the top of Kennesaw Mountain will be closed to private vehicles and cyclists due to construction and painting. The park's Visitor Center is still accessible. This work is in preparation for the upcoming Safety Improvement Project. For updates, continue to check park's website.",Park Closure,[],2026-01-14 00:00:00.0,Kennesaw Mountain National Battlefield Park,SER,KEMO,GA,yes,2026-02-17
EF614A2C-8A9A-4188-AED2-768723DD55A3,https://www.nps.gov/seki/planyourvisit/road-conditions.htm,A Few Small Roads Closed Due to Roadway Damage and/or Repair Work,SEKI,"These roads are closed due to roadway damage during past storm events and/or repairs to roadway damage: Middle Fork Rd, Redwood Canyon Rd, South Fork Rd, Crystal Cave Rd",Park Closure,"[{'title': 'Road Closures Related to Road Damage From and/or Repairs Of Past Storm Events', 'id': 'EF614A2C-8A9A-4188-AED2-768723DD55A3', 'type': 'roadevent', 'url': 'https://www.nps.gov/seki/planyourvisit/conditions.htm'}]",2026-01-13 00:00:00.0,Sequoia & Kings Canyon,PWR,SEKI,CA,yes,2026-02-17
020DE4D9-0335-4AAA-91C4-E88B306B4230,,Generals Highway Closed For the Season Between Grant Grove and Giant Forest,SEKI,"Generals Highway is closed between Lodgepole Village and Montecito Lodge for the winter season. It is not possible to drive between Grant Grove/General Grant Tree in Kings Canyon National Park and Giant Forest and General Sherman Tree in Sequoia National Park. The closed section usually opens in late March, depending on snow conditions.",Park Closure,"[{'title': 'Generals Highway Seasonal Closure Between Sequoia and Kings Canyon National Parks', 'id': '020DE4D9-0335-4AAA-91C4-E88B306B4230', 'type': 'roadevent', 'url': 'https://www.nps.gov/seki/planyourvisit/conditions.htm'}]",2026-01-13 00:00:00.0,Sequoia & Kings Canyon,PWR,SEKI,CA,yes,2026-02-17
C4F71625-FCE4-4382-8989-820CAAF15D8B,,Bridge Closure on FM 2610,BITH,The bridge over Menard Creek on Farm to Market Road (FM) 2610 is closed for construction. Birdwatchers Trail is open and accessible from the south through Romayor.,Information,[],2026-01-11 00:00:00.0,Big Thicket National Preserve,IMR,BITH,TX,yes,2026-02-17
