id,url,title,park alpha,description,category,relatedRoadEvents,LastIndexedDate,park,region,alpha,State,Road Closed Flag,date
DF381D66-D1B0-4097-AA24-E18AEF4D0CD2,https://www.nps.gov/elma/planyourvisit/el-calderon-trail-closed.htm,"El Calderon Trail closed for construction August 11, 2025 through May 2026",ELMA,"The El Calderon Trail and parking area are closed from August 11, 2025, through late May 2026 for a major improvement project. NPS Road 100 will remain open for local traffic only, and the Continental Divide Trail will remain open for CDT thru-hikers.",Park Closure,[],2025-09-21 00:00:00.0,El Malpais National Monument,IMR,ELMA,NM,yes,2026-02-17
E71075A9-7B49-41E9-9245-C97CF151772A,https://www.nps.gov/vick/planyourvisit/illinois-memorial-restoration.htm,Illinois Memorial Closed for Restoration,VICK,"The memorial itself is closed for restoration starting on September 16, 2025. The parking area is partially closed. Parking spaces are open to allow access to Tour Stop 2/Shirley House. Tour Stop 3/3rd Louisiana Redan is open. The Tour Road is open.",Park Closure,[],2025-09-18 00:00:00.0,Vicksburg National Military Park,SER,VICK,MS,yes,2026-02-17
242DC728-7BD3-46D6-B3AD-AFF46852B76D,https://www.facebook.com/share/p/1HZoom3uMr/,"Dingmans Falls Trail, Road, and Access Closed for Bridge Replacement",DEWA,"Dingmans Falls site is closed for a bridge replacement project and trail rehabilitation. All traffic, including pedestrian, cyclist, and vehicle traffic, is prohibited on the road and trail during construction.",Park Closure,"[{'title': 'Dingmans Falls Road Bridge Replacement', 'id': '242DC728-7BD3-46D6-B3AD-AFF46852B76D', 'type': 'roadevent', 'url': 'https://www.nps.gov/dewa/planyourvisit/conditions.htm'}]",2025-09-17 00:00:00.0,Delaware Water Gap National Recreation Area,NER,DEWA,PA,yes,2026-02-17
2447DCCC-35CB-487A-9E1D-ABD719B80885,,Road Construction Continues on a Section of Brotherton Road in Chickamauga Battlefield,CHCH,"The Brotherton Road closure, between Alexander's Bridge and LaFayette Roads, remains in effect as rehabilitation continues. During the closure, all public traffic is prohibited from using the closed section.",Information,"[{'title': 'Closure of a Section of Brotherton Road in Chickamauga Battlefield', 'id': '2447DCCC-35CB-487A-9E1D-ABD719B80885', 'type': 'roadevent', 'url': 'https://www.nps.gov/chch/planyourvisit/conditions.htm'}]",2025-09-05 10:56:54.0,Chickamauga and Chattanooga National Military Park,SER,CHCH,GA,yes,2026-02-17
9CEBB013-E065-4991-9B4F-8999791EBD1B,https://www.nps.gov/guis/learn/news/gulf-islands-begins-construction-on-davis-bayou-bike-pedestrian-path-phase-2.htm,Road workers on Park Road in Davis Bayou,GUIS,Phase II of the Davis Bayou Bicycle and Pedestrian Path and road resurfacing project has begun. Visitors may encounter minor traffic delays and flaggers on Park Road.,Caution,[],2025-07-25 15:19:56.0,Gulf Islands National Seashore,SER,GUIS,"FL,MS",yes,2026-02-17
56514FAE-9B63-4D54-A6AA-06DAB5F54DF5,https://www.cambridgema.gov/Departments/transportation/News/2025/07/2025mtauburnstreetclosures,Extended Mt. Auburn Street and Sparks Street Closure,LONG,"Local road closures and detours on Mount Auburn Street and Sparks Street, and a lane closure on Memorial Drive, may affect traffic and directions to the site. Please observe posted detour and traffic change signs.",Information,[],2025-07-21 13:50:41.0,Longfellow House-Washington's Headquarters National Historic Site,NER,LONG,MA,yes,2026-02-17
CC024477-31EC-4B33-8681-7AE19F572DAC,,Green River Ferry Temporarily Closed,MACA,The Green River Ferry is temporarily closed for several months while repairs are made to its navigational system and support towers which sustained extensive damage during flooding in April 2025.,Park Closure,[],2025-07-07 11:19:49.0,Mammoth Cave National Park,SER,MACA,KY,yes,2026-02-17
1F894524-F43E-4F7B-865B-C07684A41BAB,https://www.nps.gov/cuis/learn/news/5-2025-cuis-parking-lot-rehab.htm,Mainland Parking Lot Closure June 2,CUIS,The mainland parking lot will be closed as of June 2 for rehab and improvements. For more information please see the press release.,Information,[],2025-05-28 14:41:51.0,Cumberland Island National Seashore,SER,CUIS,GA,yes,2026-02-17
05E37F8F-335F-4C59-903F-B1273C07D502,https://www.nps.gov/shil/corinth-road-closure.htm?fbclid=IwY2xjawKUUS9leHRuA2FlbQIxMABicmlkETFFYmZheldUM2JiM0c0bURTAR7VrtpSy2g5PYdYlac2sYHahrNHBDwnI2nrZiUU0mMpsJUPdXUnkqkszK7jvQ_aem_M5of5PkhZ7ewJoWRjx56uw,"Major Road Closure in Corinth, MS",SHIL,"ALERT - Major Road Closure in Corinth, Mississippi. A major bridge replacement has begun on North Polk Street in Corinth, MS, and motorists will need to seek other routes. The work is not estimated to be completed until July or August 2026.",Information,[],2025-05-16 13:12:17.0,Shiloh National Military Park,SER,SHIL,TN,yes,2026-02-17
0B14D270-6F2D-4D48-B947-895D7466EE9D,,Possible Delays on Old Mine Road due to Van Campens bridge repairs,DEWA,"Due to a bridge repair project over the Van Campens Brook, visitors on Old Mine Road may encounter delays over Summer 2025. The road will remain open, with single-lane traffic during working hours.",Information,"[{'title': 'Van Campens Brook Bridge Repair Project', 'id': '0B14D270-6F2D-4D48-B947-895D7466EE9D', 'type': 'roadevent', 'url': 'https://www.nps.gov/dewa/planyourvisit/conditions.htm'}]",2025-05-13 15:04:22.0,Delaware Water Gap National Recreation Area,NER,DEWA,PA,yes,2026-02-17
B7FE65A8-C8D0-4A97-906A-EAD896F10083,,Main Street Walpack Bridge Closed Until Further Notice,DEWA,Main Street in Walpack Center is closed at the Flatbrook Bridge due to structural damage to the bridge.,Information,"[{'title': 'Road Closures in New Jersey', 'id': 'B7FE65A8-C8D0-4A97-906A-EAD896F10083', 'type': 'roadevent', 'url': 'https://www.nps.gov/dewa/planyourvisit/conditions.htm'}]",2025-05-13 15:00:38.0,Delaware Water Gap National Recreation Area,NER,DEWA,PA,yes,2026-02-17
DF56679B-6E29-4831-A020-906576B3F309,,Parking Lot Closure,FRLA,"Due to ongoing construction, the parking lot is closed. Ample street parking can be found along Dudley Street, including the Brookline Reservoir. For accessible parking, please visit our ""Contact Us"" page for more information.",Park Closure,[],2025-05-09 15:58:30.0,Frederick Law Olmsted National Historic Site,NER,FRLA,MA,yes,2026-02-17
A3EF71AE-63D1-48C7-A970-3A08ED77AFFE,,Road Closure and Fishing Pier Impact,FOMR,"The Engineer Wharf, one of two fishing piers at Fort Monroe is temporarily closed. The Finger Pier remains open. Also closed is the section of Fenwick Road between Ingalls and the East Gate of the fort. Detour signs will aid travelers around the closure.",Park Closure,[],2025-05-01 10:15:52.0,Fort Monroe,NER,FOMR,VA,yes,2026-02-17
E4538614-62B2-4C76-B623-EFD9BA55B8C7,https://www.nps.gov/vick/planyourvisit/grant-circle-and-north-union-ave-repairs.htm,North Union Avenue and Grant Circle Closed for Repairs,VICK,North Union Avenue and Grant Circle are closed to vehicular and pedestrian traffic for repairs. Entering these construction areas is prohibited. This work is to repair severe weather damage in 2020. The remainder of the park and tour road are open.,Park Closure,[],2025-04-02 10:18:12.0,Vicksburg National Military Park,SER,VICK,MS,yes,2026-02-17
AB6D9AA5-0899-4E4F-A6B5-A28365367388,https://www.nps.gov/cave/planyourvisit/conditions.htm#flood,Closures Due to Flood Damage,CAVE,Some areas of the park including Walnut Canyon Desert Drive and some trails remain closed after extensive flood damage. The main park road to the visitor center and cavern is open.,Information,[],2025-03-05 12:00:34.0,Carlsbad Caverns National Park,IMR,CAVE,NM,yes,2026-02-17
9FD779B4-D9BE-49BC-88CF-5D6CE8802AE1,https://www.nps.gov/colo/planyourvisit/colo-parkway-rehab.htm,Rehabilitation of Colonial Parkway continues with additional Parkway closures,COLO,"Beginning Tuesday, April 9, 2024, construction will close the Colonial Parkway to all travel in either direction between Yorktown and VA Route 199. Follow all detour signs. See additional closure information in the link below.",Park Closure,[],2024-11-06 16:36:53.0,Colonial National Historical Park,NER,COLO,VA,yes,2026-02-17
062971A7-A9C9-48C1-B747-20233FA784A8,https://www.nps.gov/vafo/planyourvisit/conditions.htm#maurice-stephens,Maurice Stephens Parking Lot Closed During Construction Project,VAFO,"The parking lot near the Maurice Stephens house, located on Rt 23 opposite from the Washington Memorial Chapel, is closed during construction and renovation work on the house. Visitors are encouraged to park in the Chapel lot for Grand Parade trail access",Information,[],2024-10-03 11:25:41.0,Valley Forge National Historical Park,NER,VAFO,PA,yes,2026-02-17
AEA5765C-8649-48C2-820D-1A6BEC99A838,https://www.nps.gov/colo/planyourvisit/colo-parkway-rehab.htm,Rehabilitation of Colonial Parkway continues with additional Parkway closures,YORK,"Beginning Tuesday, April 9, 2024, construction will close the Colonial Parkway to all travel in either direction between Yorktown and VA Route 199. Follow all detour signs. See additional closure information in the link below.",Park Closure,[],2024-07-11 13:53:20.0,Yorktown Battlefield,NER,YORK,VA,yes,2026-02-17
8387550D-F98F-4B78-958A-00485EC8A653,https://www.nps.gov/colo/planyourvisit/colo-parkway-rehab.htm,Rehabilitation of Colonial Parkway continues with additional Parkway closures,JAME,"Beginning Tuesday, April 9, 2024, construction will close the Colonial Parkway to all travel in either direction between Yorktown and VA Route 199. Follow all detour signs. See additional closure information in the link below.",Park Closure,[],2024-07-11 13:49:34.0,Historic Jamestowne,NER,JAME,VA,yes,2026-02-17
88590FD8-1D4F-47D8-99C4-DB9D7E172BAD,,River Ferry at Akers (on State Highway K) CLOSED until further notice,OZAR,The Akers Ferry on State Highway K will not be in service until further notice.,Caution,"[{'title': 'Akers Ferry Closure', 'id': '88590FD8-1D4F-47D8-99C4-DB9D7E172BAD', 'type': 'roadevent', 'url': 'https://www.nps.gov/ozar/planyourvisit/conditions.htm'}]",2024-03-05 10:29:47.0,Ozark National Scenic Riverways,MWR,OZAR,MO,yes,2026-02-17
123E2192-4095-4B79-9752-D7408F4D6B4D,https://www.nps.gov/buff/planyourvisit/south-woolum-road-closed-alternate-route-available.htm,"South Woolum Road Closed, Alternate Route Available",BUFF,"In the interest of safety, the South Woolum Road has been closed. The Woolum launch and campground remain open.",Park Closure,"[{'title': 'South Woolum Road Closure', 'id': '123E2192-4095-4B79-9752-D7408F4D6B4D', 'type': 'roadevent', 'url': 'https://www.nps.gov/buff/planyourvisit/conditions.htm'}]",2024-02-23 12:47:47.0,Buffalo National River,MWR,BUFF,AR,yes,2026-02-17
97D83B2E-A67F-4C5F-96F0-A173B573BF7B,https://www.nps.gov/thingstodo/gumo_drive_to_williams_ranch.htm,Williams Ranch Road Closed,GUMO,The Williams Ranch Road is currently impassable and closed to public access due to unsafe conditions.,Information,"[{'title': 'Williams Ranch Road Closure', 'id': '97D83B2E-A67F-4C5F-96F0-A173B573BF7B', 'type': 'roadevent', 'url': 'https://www.nps.gov/gumo/planyourvisit/conditions.htm'}]",2024-02-01 17:37:05.0,Guadalupe Mountains National Park,IMR,GUMO,TX,yes,2026-02-17
57F5103D-99E6-445B-BD93-F947D4EA6E06,https://www.nps.gov/whsa/planyourvisit/park-closures.htm,Park Closures,WHSA,From time to time the missile range that surrounds the park performs military testing that may require the closure of the park or Highway 70. Please plan your visit around upcoming military tests.,Information,[],2024-01-02 13:34:42.0,White Sands National Park,IMR,WHSA,NM,yes,2026-02-17
FA896BD1-1B45-4E5B-9C1E-9D80826053A6,https://www.nps.gov/laro/learn/news/hawk-creek-lane-restriction.htm,Hawk Creek Lane Restriction at Lake Roosevelt National Recreation Area,LARO,"Due to undercutting action of Hawk Creek on the access road between the Hawk Creek campground and boat launch, the road will be reduced to one lane until further notice. Use caution while on this road.",Park Closure,[],2023-12-11 14:56:18.0,Lake Roosevelt National Recreation Area,PWR,LARO,WA,yes,2026-02-17
34A77005-0F10-46D2-887F-6ED1F43A6C2D,,"Pozo Nuevo Road to Bates Well Ranch High Clearance, 4-Wheel Drive Only",ORPI,"High Clearance, 4-wheel drive is required from where Pozo Nuevo Road begins along South Puerto Blanch Drive to Bates Well Ranch area. The road is washed out in areas. Bates Well Ranch is still accessible from the north on Darby Well Road.",Caution,[],2023-10-24 15:55:47.0,Organ Pipe Cactus National Monument,IMR,ORPI,AZ,yes,2026-02-17
7BFF9E67-1275-4440-8396-6ED36C900F7A,,Roadwork may cause delays on US 41/Tamiami Trail,EVER,"Current roadwork is ongoing along the park's northern boundary on US Highway 41/Tamiami Trail to raise the road for Everglades Restoration benefits. Drivers may experience up to 15-minute delays and should watch for personnel, equipment and slow downs.",Caution,[],2023-04-20 18:00:07.0,Everglades National Park,SER,EVER,FL,yes,2026-02-17
35BD1159-10BB-41BC-963B-C663652CFBC2,,County Line Road Closed Monday To Friday,VAFO,"County Line Road is closed during the week, from Monday through Friday. The closure will apply to all vehicular, pedestrian, and bicycle traffic. Please find an alternate route.",Information,[],2023-04-17 13:51:33.0,Valley Forge National Historical Park,NER,VAFO,PA,yes,2026-02-17
1ED85C21-EB71-4CBE-80A9-4A889494FA4E,,Temporary Blackland Prairie Trail Closure to Equestrians,NATT,"Heavy rain has undermined a culvert making it unsafe for passage. Due to horse trailer parking availability, the entire section is closed to equestrians. Hikers are still able to travel from the railroad tracks to the Parkway Visitor Center.",Park Closure,[],2023-03-08 14:47:37.0,Natchez Trace National Scenic Trail,SER,NATT,"AL, MS, TN",yes,2026-02-17
89E8F214-29EB-4BF5-B85E-01A4212E4F69,https://www.nps.gov/dena/planyourvisit/conditions.htm,Park Operations Altered Due to Pretty Rocks Landslide,DENA,Summer access to facilities and services in Denali remains altered due to the Pretty Rocks Landslide and the associated closure of the Park Road at Mile 43. Check here for more information on what to expect.,Park Closure,[],2022-09-19 14:11:22.0,Denali National Park and Preserve,AKR,DENA,AK,yes,2026-02-17
76963DF5-FF4B-4C00-8F86-2ECA0AED7446,https://www.nps.gov/pinn/planyourvisit/hours.htm,High Crowds & Park Capacity,PINN,"High visitation may require limiting access to Bear Gulch and other parking areas in the park. If all parking lots reach capacity, incoming traffic will not pass the campground until space is available. This occurs most often between 8a and 3p on weekends",Information,[],2022-01-19 14:37:31.0,Pinnacles National Park,PWR,PINN,CA,yes,2026-02-17
D992F239-4C85-45CE-B471-5107FEC177B2,https://www.nps.gov/chis/planyourvisit/conditions.htm,Santa Barbara Island Dock Closed; Landings Restricted to Adjacent Rocky Ledge,CHIS,"Santa Barbara Island is open to public access, but landings are restricted to the rocky ledge adjacent to the dock. The dock is closed and is not expected to be repaired in the near future due to the severe winter storm damage.",Information,[],2018-01-23 14:42:10.0,Channel Islands National Park,PWR,CHIS,CA,yes,2026-02-17
